review_id,movie_id,content,review_date,reviewer_name,rating
1468,51,Really enjoyed it! Worry professional red such owner.,2025-02-13 12:15:58,Joan Baldwin,4
1469,51,Average movie. Should ability song herself successful water expect entire.,2025-03-05 20:14:06,Richard James,3
1470,51,Really enjoyed it! May gun talk return bag pick lawyer.,2025-02-09 13:01:03,Corey Callahan,4
1471,51,Would recommend to friends. Last animal son.,2025-02-22 06:59:34,Dylan Adams,4
1472,51,Average movie. General set particularly see culture.,2025-03-06 10:04:28,Justin Chambers,3
1473,51,Not worth the ticket price. Laugh number big behind per.,2025-02-16 11:01:20,Heather Scott,2
1474,51,Really enjoyed it! View picture democratic respond.,2025-02-07 06:02:15,Travis Cannon,4
1475,51,Terrible movie! Tell form top team.,2025-03-04 21:07:38,Albert Garcia,1
1476,51,Would recommend to friends. Knowledge quite wonder certain court professional.,2025-03-06 16:26:06,Hannah Smith,4
1477,51,"Some good moments, but overall meh. Many join structure pull us day hope.",2025-02-06 01:07:16,Mr. John Nelson,3
1478,51,Masterpiece! Exactly someone key ball give only night.,2025-02-07 03:28:51,Lisa Baker,5
1479,51,Could have been better. Add happy keep after senior avoid office.,2025-02-13 12:03:12,Mary Moore,2
1480,51,Worst movie I've seen this year. Determine edge attack character with avoid.,2025-02-21 00:57:29,Madeline Reed,1
1481,51,Average movie. Instead include character.,2025-02-18 21:22:58,Diane Thomas,3
1482,51,Could have been better. Note pattern fire.,2025-03-05 10:28:01,Sydney Cohen,2
1483,51,"Some good moments, but overall meh. Hair purpose five expect realize true.",2025-02-27 13:44:21,Jennifer Duncan,3
1484,51,Could have been better. Explain focus oil discuss rule statement again.,2025-02-07 22:35:48,Jeanne Santos,2
1485,51,"Decent, but forgettable. Stay serious exactly theory third.",2025-02-20 16:18:16,Samuel Cordova,3
1486,51,Terrible movie! Leave poor minute natural total home see.,2025-03-05 16:01:10,Jeffrey Lara,1
1487,51,Worst movie I've seen this year. Forget view eye order cold.,2025-02-20 20:34:16,Mark Rios,1
1488,51,Really enjoyed it! Forget detail field it base human past.,2025-02-25 11:27:17,Seth Hernandez,4
1489,51,Would recommend to friends. Western concern tend care through would approach.,2025-02-11 20:35:38,Thomas Rosario,4
1490,51,Could have been better. Court tend single central.,2025-02-19 15:41:09,John Figueroa,2
1491,51,Terrible movie! Woman bring pay various toward pull.,2025-03-05 22:37:49,John Matthews,1
1492,51,Average movie. Floor drop bar issue trouble mind identify.,2025-02-05 06:45:55,Robert Mason,3
1493,51,Would recommend to friends. College owner summer method.,2025-03-04 22:38:49,Dan Vargas,4
1494,52,Would recommend to friends. Fund measure song push few movement may.,2025-03-03 07:57:56,Kelly Garcia,4
1495,52,Masterpiece! Body stand high control arrive style house policy.,2025-02-11 10:55:57,Benjamin Herrera,5
1496,52,Really enjoyed it! True base foreign instead.,2025-02-07 04:17:36,Michelle King,4
1497,52,"Some good moments, but overall meh. Send food institution member operation around.",2025-02-06 11:30:08,Jennifer Ryan,3
1498,52,Waste of time and money. Sense his rest be store support very per.,2025-03-05 03:21:20,Nicholas Krause,1
1499,52,Waste of time and money. Mind far financial ready century.,2025-03-01 14:52:32,Carol Ortega,1
1500,52,Average movie. Management coach next short discover.,2025-02-08 04:09:03,Cheryl Johnston,3
1501,52,"Some good moments, but overall meh. Everybody realize land.",2025-02-24 14:58:26,William King,3
1502,52,Disappointing. Professor sport carry particular.,2025-03-06 15:40:14,Jonathan Obrien,2
1503,52,"Some good moments, but overall meh. Smile data allow support.",2025-03-04 23:13:01,Amanda Gomez,3
1504,52,Great movie with some minor flaws. Writer learn she if marriage with focus.,2025-02-06 16:15:55,Mr. Erik Holmes,4
1505,52,Absolutely amazing! Able wife firm certainly chance crime.,2025-02-21 09:58:53,Cynthia Owens,5
1506,52,Disappointing. Season fine understand pattern week rule science.,2025-03-01 21:00:32,Janet Morgan,2
1507,52,Waste of time and money. Operation board hour feeling wife.,2025-02-14 19:58:24,Kathleen Tyler,1
1508,52,Absolutely amazing! Simply four bill matter around floor have.,2025-02-21 18:26:47,Jared Griffin,5
1509,52,Worst movie I've seen this year. Future treatment father whatever.,2025-03-04 10:20:45,Kevin Ruiz,1
1510,52,Best movie I've seen in years! Organization cut side attention west dream.,2025-02-13 20:05:42,Brian Chambers,5
1511,52,Masterpiece! Seek sense near guess.,2025-02-10 14:05:04,Richard Williams,5
1512,52,Would recommend to friends. Recent talk term offer above show civil support.,2025-03-02 23:07:07,Jennifer Smith,4
1513,52,Masterpiece! High goal thank find.,2025-03-01 12:39:51,Jenna Ewing,5
1514,52,"Some good moments, but overall meh. Himself husband clear either.",2025-02-24 01:20:44,Shannon Greer,3
1515,52,Worst movie I've seen this year. Result rather black everybody area account single.,2025-02-08 01:15:21,Elizabeth Brooks,1
1516,52,Average movie. Structure a light next glass.,2025-02-21 07:50:38,Kaitlin Armstrong,3
1517,52,Great movie with some minor flaws. Mission space build imagine standard.,2025-02-20 23:14:28,Russell Griffith,4
1518,52,Waste of time and money. Our hundred prove.,2025-02-14 07:07:15,Richard Mckenzie,1
1519,52,Waste of time and money. Bar natural member glass.,2025-02-13 14:02:17,Elizabeth Jordan,1
1520,52,Would recommend to friends. Personal national player reason student.,2025-03-02 12:03:55,Robin Stevens,4
1521,52,Best movie I've seen in years! Study stuff role among modern gas should.,2025-02-05 14:33:28,Michael Day,5
1522,52,Best movie I've seen in years! Movement particularly trip drop as know miss rich.,2025-02-27 00:34:22,Jill Parks,5
1523,52,Really enjoyed it! Become water writer watch.,2025-03-06 10:41:42,Alexandra Peters,4
1524,52,Absolutely amazing! Expect partner save end.,2025-02-16 16:32:57,Christopher Mayo,5
1525,53,Not worth the ticket price. West seek effort team.,2025-02-07 02:18:41,Scott Acosta,2
1526,53,Terrible movie! Firm case when war.,2025-02-26 20:36:49,Stephanie Thomas,1
1527,53,Best movie I've seen in years! Understand cultural how.,2025-02-06 11:14:27,Edward Daniels,5
1528,53,Masterpiece! Traditional century rise benefit.,2025-02-22 17:51:38,Michael Thomas,5
1529,53,Terrible movie! Prevent above design religious up catch just investment.,2025-02-22 06:43:08,Billy Page,1
1530,53,Could have been better. Better bank return sound.,2025-02-12 05:28:37,Henry Vazquez,2
1531,53,Would recommend to friends. Attorney tough how official drop enough energy wide.,2025-02-15 19:25:06,Thomas Sutton,4
1532,53,Terrible movie! Dream industry away life.,2025-02-11 20:29:00,Nancy Schmidt,1
1533,53,Worst movie I've seen this year. Top model painting step pick science clearly.,2025-03-06 13:20:46,Jacob Kennedy,1
1534,53,Absolutely amazing! Make agent even address better have.,2025-02-25 13:04:46,David Swanson,5
1535,53,Absolutely amazing! Sport debate tonight total bill star itself.,2025-03-01 16:09:56,Elizabeth Reyes,5
1536,53,Terrible movie! Such relationship crime actually hot present.,2025-02-18 02:21:47,Amanda Wang,1
1537,53,"Some good moments, but overall meh. Collection science mean good.",2025-03-01 10:24:11,Teresa Singleton,3
1538,53,Terrible movie! Technology charge sing think always it.,2025-02-07 05:35:50,David Bender DVM,1
1539,53,Terrible movie! Office some mouth.,2025-03-04 18:22:01,Andrew Rice,1
1540,53,Average movie. South learn sea clear process skin.,2025-02-28 16:37:54,Maria Evans,3
1541,53,Best movie I've seen in years! Thus amount successful over event each science sign.,2025-02-06 18:38:39,Oscar Carlson,5
1542,53,"Decent, but forgettable. Practice pass her common yard ball then.",2025-02-20 00:09:14,David Murphy,3
1543,53,Really enjoyed it! Item imagine include.,2025-02-05 02:14:06,Heidi Burch,4
1544,53,"Decent, but forgettable. Traditional company story play discover everything section.",2025-03-01 18:02:01,Jason Benjamin,3
1545,53,Masterpiece! American individual season those.,2025-02-09 09:38:08,Blake Lee,5
1546,53,Really enjoyed it! Catch rather focus even.,2025-03-02 21:39:57,Mallory Bryant,4
1547,53,"Decent, but forgettable. Around voice purpose rich.",2025-03-06 11:24:24,David Jones,3
1548,53,Waste of time and money. Growth onto human seat various fish.,2025-02-25 10:15:29,Elizabeth Sanders,1
1549,53,Absolutely amazing! Heart ready exactly eight interest teach program.,2025-03-06 09:10:21,Taylor Mcgee,5
1550,53,"Some good moments, but overall meh. Air likely call prove.",2025-02-05 00:06:24,Michael Wolf,3
1551,53,Disappointing. Special family choose perhaps a common.,2025-02-20 04:40:18,Brian Davis,2
1552,53,Would recommend to friends. Management usually about rate.,2025-02-05 11:45:00,Henry Decker,4
1553,53,Terrible movie! Stop local central later second activity attention.,2025-02-20 23:02:07,Michael Tran,1
1554,53,Not worth the ticket price. Rule reason seat table western nearly western region.,2025-02-27 01:47:46,Susan Pham,2
1555,53,Average movie. Animal various citizen her nor.,2025-02-27 05:04:43,Carolyn Cook,3
1556,53,Absolutely amazing! Ask similar certainly week.,2025-02-22 13:46:57,David James,5
1557,53,Really enjoyed it! Trouble human consider huge investment eye.,2025-02-24 10:06:39,Miss Dawn Mooney DDS,4
1558,54,Absolutely amazing! Region catch state speech former.,2025-03-02 11:26:48,Brandon Sanchez,5
1559,54,Absolutely amazing! Eye place face which.,2025-02-25 13:01:47,Pamela Keller,5
1560,54,Waste of time and money. Figure produce debate family instead.,2025-02-10 14:48:04,Tracy Norton,1
1561,54,Average movie. Staff require speak agent.,2025-02-08 17:58:08,Julia Mendoza,3
1562,54,Would recommend to friends. Already cover song maintain.,2025-02-26 12:02:43,Virginia Howard,4
1563,54,"Decent, but forgettable. Pattern beautiful help camera lawyer.",2025-02-15 16:55:48,Amanda Jimenez,3
1564,54,Great movie with some minor flaws. Behind those sure dog a.,2025-03-01 09:51:14,Sarah Gonzales,4
1565,54,Best movie I've seen in years! However training itself group join suffer attack.,2025-02-07 22:55:18,William Garcia,5
1566,54,Would recommend to friends. Rest husband group general these sit or.,2025-02-17 01:31:12,Tanner Cole,4
1567,54,Great movie with some minor flaws. Family trip concern.,2025-02-14 07:50:54,Ashley Moyer,4
1568,54,Absolutely amazing! Contain possible market campaign.,2025-03-02 23:39:48,Brian Price,5
1569,54,Really enjoyed it! Finally hotel board public leader.,2025-02-18 15:36:40,Mark Nolan,4
1570,54,Terrible movie! Now western live her management that.,2025-02-08 07:55:31,Carmen Greene,1
1571,54,Really enjoyed it! Space pattern all serious ahead explain.,2025-03-02 00:17:39,William Gomez,4
1572,54,Terrible movie! Discover apply college discover stop may.,2025-02-20 06:53:34,Douglas Randall,1
1573,54,Best movie I've seen in years! Address teacher although certain.,2025-03-01 12:18:39,Brett Stephens,5
1574,54,Best movie I've seen in years! Fear able join unit about community each.,2025-02-18 04:03:21,Edward Miller,5
1575,54,Terrible movie! Claim article town analysis.,2025-02-20 23:24:37,Pamela Coleman,1
1576,54,Disappointing. Provide prepare rock want performance figure.,2025-02-05 18:57:40,Ashley Hester,2
1577,54,Not worth the ticket price. Through himself since though.,2025-03-03 02:35:27,Pamela Davis,2
1578,54,"Some good moments, but overall meh. About child huge that ball situation.",2025-03-06 07:05:05,Marc Butler,3
1579,54,Terrible movie! Along accept able you opportunity husband start.,2025-02-05 06:37:41,Ashley Taylor,1
1580,54,"Some good moments, but overall meh. Visit until order rise reason six end.",2025-02-25 23:55:35,Javier Chavez,3
1581,54,Not worth the ticket price. Send walk run kind across structure compare.,2025-02-06 08:35:45,Christopher Wilson,2
1582,54,Would recommend to friends. Reduce special more country wall.,2025-02-24 09:29:51,Luke Bright,4
1583,54,"Decent, but forgettable. Wife church painting million newspaper.",2025-02-12 02:34:59,Scott Smith,3
1584,54,Average movie. Wife education subject recently door also key.,2025-02-21 00:35:32,Ronnie Hudson,3
1585,54,Could have been better. Ask hot manage line.,2025-02-06 06:25:12,Steven Lawson,2
1586,55,Absolutely amazing! Decision perhaps sea several candidate its event.,2025-03-03 12:05:56,Christopher Wilkins,5
1587,55,Worst movie I've seen this year. Bad other bit be loss such image.,2025-02-27 04:59:12,Stephanie Davis,1
1588,55,Really enjoyed it! Get than particular part guy military.,2025-02-14 20:39:48,Angela Walls,4
1589,55,Could have been better. Mean model though fish could.,2025-03-03 14:37:46,Brandy Hutchinson,2
1590,55,Average movie. Day thus plant conference difference nothing.,2025-02-23 19:13:59,Lisa Mercer,3
1591,55,Masterpiece! Personal laugh a draw Mrs couple.,2025-03-03 11:58:17,Lisa Beltran DVM,5
1592,55,Best movie I've seen in years! Human send sort wait.,2025-02-22 09:14:52,Elizabeth Hoover,5
1593,55,Disappointing. Others detail either standard hotel in.,2025-02-17 17:55:12,Sandra Morris,2
1594,55,Average movie. Less military history ability affect sea man.,2025-02-14 04:25:54,Richard Carlson,3
1595,55,Terrible movie! Record other since quality thing end require.,2025-03-02 00:32:44,Amanda Mckay,1
1596,55,Really enjoyed it! Fight time red.,2025-02-11 16:32:28,Anthony Branch,4
1597,55,Best movie I've seen in years! Upon experience start size.,2025-02-19 03:53:28,Kevin Cruz,5
1598,55,Best movie I've seen in years! Kitchen require list.,2025-02-15 00:22:14,Elizabeth Campbell,5
1599,55,Could have been better. Particularly practice before question.,2025-02-07 04:14:49,Theresa Berger,2
1600,55,Really enjoyed it! Attention TV management message.,2025-02-08 14:48:25,Victoria Turner,4
1601,55,Not worth the ticket price. Bring rich age push system before enter.,2025-02-08 16:49:27,Lisa Nguyen,2
1602,55,Best movie I've seen in years! Left but ahead sense hear guess reach see.,2025-02-11 08:58:40,Amanda Thomas,5
1603,55,Best movie I've seen in years! System shoulder job owner.,2025-02-07 08:52:43,Kenneth Vargas,5
1604,55,Not worth the ticket price. Rich imagine bring must nearly.,2025-02-16 06:15:01,Christopher Carr,2
1605,55,Best movie I've seen in years! Action recent white standard.,2025-02-21 19:34:01,Lauren Kelly,5
1606,55,Terrible movie! Fact field service yeah.,2025-02-22 13:02:33,Nicholas Chan,1
1607,55,Best movie I've seen in years! Turn person question information Congress very recent.,2025-02-13 05:22:35,Theresa Young,5
1608,55,Worst movie I've seen this year. Both matter instead key.,2025-02-21 23:53:17,Elizabeth Hardy,1
1609,55,Worst movie I've seen this year. In role particularly throw car send significant challenge.,2025-02-19 10:10:59,Melissa Webb,1
1610,55,Disappointing. Improve inside board report rule evidence recently stop.,2025-02-22 23:05:38,Kaitlin Harris,2
1611,55,Masterpiece! Quality herself enjoy ability try hit.,2025-02-26 21:01:33,Jason Leonard,5
1612,55,Terrible movie! Same modern bad.,2025-02-13 00:34:05,Barbara Lawrence,1
1613,55,Terrible movie! College rate prove.,2025-02-11 23:38:38,David Terry,1
1614,56,Best movie I've seen in years! So must recognize develop.,2025-02-07 10:04:24,Cody Perkins,5
1615,56,Disappointing. Couple begin change.,2025-02-17 16:31:15,Angel Green,2
1616,56,Could have been better. Likely economy shoulder pass how dog live.,2025-02-07 23:51:12,Brandon Price,2
1617,56,"Some good moments, but overall meh. They history like modern return.",2025-02-22 14:42:22,Rachel Owen,3
1618,56,"Some good moments, but overall meh. Yet national question detail crime.",2025-03-02 17:45:22,David Christensen,3
1619,56,Great movie with some minor flaws. Weight well human land.,2025-02-27 20:38:51,Timothy Miller,4
1620,56,Would recommend to friends. Open effort wrong left yes culture method.,2025-02-13 00:31:13,Jamie Jones,4
1621,56,Terrible movie! Treatment with two style.,2025-02-23 21:46:17,Erik Collier,1
1622,56,Terrible movie! Little hard during detail decade fish within media.,2025-02-06 03:01:44,Joshua Park,1
1623,56,Disappointing. Return maintain level perhaps wall lot machine.,2025-02-16 00:57:46,Rachel Patterson,2
1624,56,Disappointing. Us project common either performance now identify other.,2025-03-05 10:29:12,James Little,2
1625,56,Could have been better. Fear image better even soon.,2025-02-26 19:40:17,Jose Richardson,2
1626,56,"Some good moments, but overall meh. Mouth shoulder few military learn.",2025-02-19 22:41:54,Mark Hopkins,3
1627,56,Terrible movie! Add indeed both your.,2025-02-12 03:46:10,Megan Yates,1
1628,56,"Some good moments, but overall meh. Thank let relationship total fine sell himself speech.",2025-02-07 11:35:56,Edward Johnson,3
1629,56,Really enjoyed it! Good beyond table any organization week.,2025-02-08 23:17:01,Michael Mullen,4
1630,56,Disappointing. Model child shoulder require often almost.,2025-03-01 07:03:54,James Maldonado,2
1631,56,Worst movie I've seen this year. Trip impact clearly need coach six across.,2025-03-04 03:09:47,Kyle Carter,1
1632,56,Not worth the ticket price. Lot agreement professor.,2025-02-19 15:44:05,Danielle Bell,2
1633,56,"Some good moments, but overall meh. Nothing quickly serious fly.",2025-02-08 11:31:37,Donna Robinson,3
1634,56,Best movie I've seen in years! Television try better.,2025-02-19 23:27:07,Elizabeth Richards,5
1635,56,Would recommend to friends. Significant cell ability heart.,2025-02-22 22:15:39,Lisa Hill,4
1636,56,Really enjoyed it! Camera despite least kitchen to evidence mean.,2025-02-26 06:56:28,Rebecca Austin,4
1637,56,Masterpiece! Election them allow be account week product.,2025-02-06 08:13:33,Gina Sullivan,5
1638,56,"Some good moments, but overall meh. Standard half account listen plant land hope third.",2025-02-11 04:56:39,Diane Smith,3
1639,56,Average movie. Or back again may.,2025-02-20 07:18:44,Jonathan Graham,3
1640,56,Would recommend to friends. Answer piece relate suffer building.,2025-02-14 15:18:30,Kenneth Orozco,4
1641,56,Best movie I've seen in years! Thousand system record front especially military on kid.,2025-02-28 19:13:25,Ellen Hall,5
1642,56,Worst movie I've seen this year. Day enter knowledge.,2025-02-21 09:53:28,Marcus Ramirez,1
1643,56,Terrible movie! World spend study want week smile.,2025-02-24 15:06:26,Michael Reed,1
1644,57,Not worth the ticket price. Wrong get drop assume religious.,2025-02-13 14:39:13,Andrea Alvarez,2
1645,57,Great movie with some minor flaws. Capital already go citizen teacher.,2025-02-11 18:29:02,Catherine Stokes,4
1646,57,Could have been better. Often line most investment.,2025-02-26 05:42:08,Teresa Taylor,2
1647,57,Disappointing. Nature perform unit because material.,2025-03-04 12:52:57,Adam Parks,2
1648,57,Disappointing. Lose talk true.,2025-02-21 04:08:20,Christopher Melendez,2
1649,57,Great movie with some minor flaws. Late drop probably final of.,2025-02-25 16:42:38,Jane Tran,4
1650,57,"Some good moments, but overall meh. Step finally daughter speak.",2025-02-26 06:55:35,Garrett Franklin,3
1651,57,"Some good moments, but overall meh. Say issue news dog need born treat his.",2025-02-16 01:17:57,Elizabeth Hernandez,3
1652,57,Masterpiece! Peace scene discuss.,2025-02-25 08:27:02,Brittany Holland,5
1653,57,Average movie. Forget medical difficult understand.,2025-02-26 11:54:01,Katrina Zuniga,3
1654,57,Could have been better. Whom choice every.,2025-02-08 20:21:26,Kaitlyn Petersen,2
1655,57,Could have been better. Resource including wrong lot event source.,2025-02-07 04:01:10,Hailey Orozco,2
1656,57,Great movie with some minor flaws. Popular amount treat difference owner drive.,2025-02-22 16:02:10,Brandy Ewing,4
1657,57,Average movie. Enough five he reach.,2025-02-24 03:36:40,Karla Torres,3
1658,57,Best movie I've seen in years! Study commercial recent tell then behind glass.,2025-03-02 11:57:28,Brenda Hernandez,5
1659,57,Really enjoyed it! Anyone color teacher measure matter.,2025-02-24 20:21:09,Robert Beltran,4
1660,57,Could have been better. Another reflect figure draw.,2025-03-06 18:30:50,Heather Carter,2
1661,57,Could have been better. City collection husband.,2025-02-05 16:01:32,Steven Mcdowell,2
1662,57,Not worth the ticket price. Wait TV another only simple.,2025-02-27 00:35:05,Charlene Johnson,2
1663,57,Could have been better. Result drug economy view his size.,2025-02-14 22:11:52,Barbara Gomez,2
1664,57,Masterpiece! Themselves ever high road fine significant.,2025-02-23 00:18:26,Jenna Fleming,5
1665,57,Great movie with some minor flaws. Them all itself area military simple why news.,2025-02-22 18:01:06,Monica Hayden,4
1666,57,Waste of time and money. Foot a sign listen forget a.,2025-02-28 02:46:18,Peter Perez,1
1667,57,"Decent, but forgettable. Worry cover reach effort a.",2025-02-07 11:08:05,Joseph Cooper,3
1668,57,Really enjoyed it! Movie chair right front.,2025-03-04 15:02:39,Victoria Cruz,4
1669,57,Best movie I've seen in years! Worker training its long tonight.,2025-02-26 19:05:36,Kelly Taylor,5
1670,57,Worst movie I've seen this year. History radio feeling.,2025-03-02 18:07:31,Dr. Cheryl Church,1
1671,57,Waste of time and money. Cup seat magazine scene fire impact range.,2025-02-16 06:15:05,Matthew Phillips,1
1672,57,Terrible movie! No how series half.,2025-02-21 17:47:36,Deanna Friedman,1
1673,57,Absolutely amazing! Discover drug visit mean.,2025-02-12 11:32:09,Jason Wolf,5
1674,57,Great movie with some minor flaws. Show rock history care agree for turn.,2025-02-17 19:33:00,Pamela Franco,4
1675,58,Could have been better. Within what lead politics our against specific.,2025-02-27 18:11:39,Christine Bailey,2
1676,58,Masterpiece! Student fire whom cut research human.,2025-03-03 03:12:09,Kenneth Matthews,5
1677,58,Best movie I've seen in years! Tend example center place kid tonight give.,2025-02-17 15:59:08,Tammy Jenkins,5
1678,58,Masterpiece! Help out use seem which.,2025-02-14 07:56:26,Stephen Flores,5
1679,58,Waste of time and money. Bed center explain.,2025-02-24 19:41:39,Mary Thomas,1
1680,58,Not worth the ticket price. Approach business item nation class.,2025-03-04 20:53:37,Elizabeth Wilson,2
1681,58,"Some good moments, but overall meh. Rather process instead garden because.",2025-03-04 09:16:36,Patricia Miller,3
1682,58,Not worth the ticket price. Top decide determine word write trade.,2025-02-23 03:57:02,Wendy Mcdonald,2
1683,58,Not worth the ticket price. Walk ask past side forward last.,2025-02-09 18:06:29,Sydney Anderson,2
1684,58,Not worth the ticket price. Reality economic interesting language.,2025-02-15 17:52:47,Robert Ingram,2
1685,58,Great movie with some minor flaws. Theory apply ever world low sure.,2025-02-06 03:12:52,Maria Vazquez,4
1686,58,Really enjoyed it! Step same score maintain decision item.,2025-02-11 22:48:55,Melissa Day,4
1687,58,Would recommend to friends. Office cell not audience this blood be.,2025-03-06 00:57:30,Jason Jimenez,4
1688,58,Masterpiece! Manage tend relate option.,2025-03-06 03:58:25,Paige Stewart,5
1689,58,Average movie. Change yeah building collection score start.,2025-02-09 23:38:15,Joel Mcintyre,3
1690,58,Best movie I've seen in years! Industry spring wrong produce program national practice as.,2025-02-19 17:55:32,Shannon Norman,5
1691,58,Waste of time and money. Fund meeting stage.,2025-02-17 22:51:42,Kelly Hernandez,1
1692,58,Best movie I've seen in years! Produce western turn return fund.,2025-03-04 15:16:02,William Mason,5
1693,58,Masterpiece! Production heart mouth quality add bit.,2025-02-27 20:39:46,April Perez,5
1694,58,Could have been better. Candidate radio fight single.,2025-02-09 18:20:02,Tracy Jones,2
1695,58,Terrible movie! Party partner again growth.,2025-02-22 21:14:40,Kevin Hanson,1
1696,58,Absolutely amazing! Director win everybody idea.,2025-02-11 12:33:42,Christopher Anderson,5
1697,58,Average movie. Read grow discuss against matter.,2025-02-16 09:20:32,Alexis Kline,3
1698,58,Not worth the ticket price. Western security everybody.,2025-02-14 22:13:27,Teresa Vazquez,2
1699,58,Best movie I've seen in years! Eye day act less sound several.,2025-03-02 03:31:46,Janet Sanders,5
1700,58,Masterpiece! Camera fly in name sea no.,2025-02-18 17:48:56,Michael Dunn,5
1701,58,Could have been better. Specific civil office expect Mr benefit expert.,2025-02-23 12:00:27,Michelle Lopez,2
1702,59,Could have been better. Television sit herself.,2025-03-05 13:09:04,Lisa Tate,2
1703,59,Great movie with some minor flaws. Step form citizen reflect collection.,2025-02-15 17:30:15,Kimberly Frey,4
1704,59,Would recommend to friends. One heart theory body food key subject occur.,2025-02-20 15:24:46,Stacey Cortez,4
1705,59,Would recommend to friends. Wife clear big subject.,2025-02-07 11:06:34,Brenda Francis,4
1706,59,"Some good moments, but overall meh. Some control establish allow affect specific.",2025-02-16 14:29:36,Carol Hernandez,3
1707,59,Waste of time and money. Republican American law system president organization training.,2025-02-14 04:00:58,Daniel Bennett,1
1708,59,Terrible movie! Model cup next least continue investment among.,2025-02-19 22:28:38,Melissa Matthews,1
1709,59,"Some good moments, but overall meh. Together television support result site word without.",2025-02-22 01:33:07,Jason Lopez,3
1710,59,Worst movie I've seen this year. Late identify three instead last camera different.,2025-02-12 16:37:45,Gabriela Nunez,1
1711,59,Could have been better. Could add physical certain compare inside side.,2025-02-24 01:28:36,Penny Ramirez,2
1712,59,Not worth the ticket price. Everyone again grow budget bar arrive.,2025-03-06 04:24:58,Michelle Bonilla,2
