review_id,movie_id,content,review_date,reviewer_name,rating
739,26,Best movie I've seen in years! Nice human husband so.,2025-02-14 00:11:56,Maria Miller,5
740,26,Great movie with some minor flaws. Large available even popular discussion sometimes.,2025-02-05 03:13:18,Charles Weaver,4
741,26,Would recommend to friends. Continue life top decision least station idea.,2025-03-01 09:38:07,Amber Johnson,4
742,26,"Decent, but forgettable. Her high spend.",2025-02-10 11:38:41,Jody Ramsey,3
743,26,Great movie with some minor flaws. Truth trip plan feel job city work.,2025-03-01 08:43:03,Thomas Hawkins,4
744,26,Absolutely amazing! End stand social discover.,2025-02-11 02:04:28,Daniel Reid,5
745,26,"Decent, but forgettable. Fire lot cover recent himself position side.",2025-03-04 22:42:24,Daniel Ayers,3
746,26,Not worth the ticket price. Few myself every despite necessary.,2025-02-07 09:42:51,Danielle Jensen,2
747,26,Not worth the ticket price. About remain beautiful view.,2025-02-15 15:01:07,Edward Fox,2
748,26,Not worth the ticket price. Mind six speech mind something they.,2025-02-14 14:18:41,Michelle Sanchez,2
749,26,Could have been better. Partner ball exist.,2025-02-13 17:08:58,Rachel Beard,2
750,26,Terrible movie! Current ready offer charge account.,2025-02-18 09:20:29,Victor Jimenez,1
751,26,Really enjoyed it! Air community ten party which ever.,2025-02-05 03:26:43,James Banks,4
752,26,Would recommend to friends. Spring support work TV official operation fill.,2025-02-16 05:08:20,Shannon Martin,4
753,26,Would recommend to friends. Study couple behind certainly.,2025-02-18 00:33:54,Sheri Brown,4
754,26,Could have been better. Do artist because risk cultural last person.,2025-02-23 05:49:21,Elizabeth Sherman,2
755,26,Best movie I've seen in years! Assume entire not.,2025-03-03 12:57:44,Sarah Sims,5
756,26,Worst movie I've seen this year. American behavior hold parent financial series.,2025-02-10 21:46:44,Jessica Todd,1
757,26,"Some good moments, but overall meh. Provide market off next tell just.",2025-02-28 09:33:51,Christina White,3
758,26,"Some good moments, but overall meh. Civil run ability majority.",2025-02-05 14:47:34,William Powers,3
759,26,Worst movie I've seen this year. Book tough we.,2025-02-14 01:16:45,James Tapia,1
760,26,Absolutely amazing! Reason break tough beyond traditional bag stock.,2025-02-20 22:58:13,Melissa Smith,5
761,26,Best movie I've seen in years! Us step should citizen white.,2025-02-13 11:51:22,Jessica Cole,5
762,26,Disappointing. Beautiful clear cut born onto stock his.,2025-02-26 22:23:40,Philip Duffy,2
763,26,Masterpiece! Traditional information dog property.,2025-02-22 21:48:02,Mark Lloyd,5
764,27,Could have been better. Leg approach would.,2025-02-23 20:36:02,Christina Newton,2
765,27,Masterpiece! Tough think stage sit be shoulder.,2025-02-18 08:52:49,Anthony Caldwell,5
766,27,Would recommend to friends. Town her reason daughter off notice much.,2025-02-27 18:56:54,Kathy Taylor,4
767,27,"Some good moments, but overall meh. Couple seem east ground behind skill.",2025-02-06 11:05:28,Derrick Wilson,3
768,27,Not worth the ticket price. Charge how moment future economic any seem realize.,2025-02-06 08:23:22,Julian Barron,2
769,27,Could have been better. Identify six down degree military key.,2025-02-06 22:10:01,Cheryl Byrd,2
770,27,Great movie with some minor flaws. Bag kid foot.,2025-02-16 00:58:18,Crystal Quinn,4
771,27,Could have been better. Score sure amount bring small leave.,2025-02-24 01:09:27,Benjamin Nguyen,2
772,27,Absolutely amazing! Society to project.,2025-03-03 16:52:08,Brian Young,5
773,27,Absolutely amazing! Life sing building away power charge.,2025-03-05 04:13:10,Nicole Davis,5
774,27,Waste of time and money. Simple country police factor.,2025-02-22 14:39:13,Emily Bruce,1
775,27,Waste of time and money. Candidate least although pick turn authority.,2025-02-07 02:01:49,Bobby Beasley,1
776,27,Not worth the ticket price. Teacher color scientist like.,2025-02-07 22:12:10,Joseph Christian,2
777,27,Waste of time and money. Listen through herself low.,2025-02-28 11:34:40,Max Williams,1
778,27,Average movie. Total rich total both know hand.,2025-02-21 14:11:11,Brittany Morrison,3
779,27,Disappointing. Car improve reveal fly large teach describe.,2025-03-01 17:15:47,Kenneth Paul,2
780,27,"Decent, but forgettable. Hair attention administration political leader.",2025-03-02 07:31:03,Aaron Carrillo,3
781,27,Worst movie I've seen this year. Agent figure stuff one evening.,2025-02-07 21:32:31,Sharon Smith,1
782,27,Disappointing. Not stand themselves.,2025-02-08 07:10:37,Ashley Moore,2
783,27,"Decent, but forgettable. Partner relationship pull wall forget.",2025-02-16 00:24:41,Michael Jones,3
784,27,Masterpiece! After floor campaign teacher benefit music.,2025-03-02 03:51:43,Samantha Hunt,5
785,27,Waste of time and money. Over responsibility meet many.,2025-02-05 07:18:53,Patrick Williams,1
786,27,Absolutely amazing! At ground market soon.,2025-02-06 18:40:04,Vanessa Anderson,5
787,27,Really enjoyed it! Authority until account.,2025-02-21 17:22:12,Danielle Bell,4
788,27,"Some good moments, but overall meh. Heart hard article child public camera hour.",2025-02-17 07:52:26,Sean Hampton,3
789,28,Great movie with some minor flaws. Again public mother billion behavior election.,2025-02-19 15:08:59,Shane Freeman,4
790,28,Waste of time and money. Than network position drug yard.,2025-02-07 23:33:17,Cameron Nicholson,1
791,28,Masterpiece! Series bring pressure never.,2025-02-19 06:04:37,Dustin Hartman,5
792,28,Terrible movie! Race right none red.,2025-03-04 23:31:45,Cory Leonard,1
793,28,Terrible movie! Everyone hope wall table present population.,2025-02-28 14:51:30,Kelly Wilson,1
794,28,Disappointing. Church myself accept travel real.,2025-02-07 02:42:29,Michael Schneider,2
795,28,Not worth the ticket price. Wrong standard official method break beat.,2025-03-02 04:42:20,April Ryan,2
796,28,Waste of time and money. Report both lawyer white require.,2025-02-07 09:36:00,Tracy Burnett,1
797,28,Would recommend to friends. Than minute son police.,2025-02-18 07:23:16,Anthony Cook,4
798,28,Disappointing. Fish continue full attorney election.,2025-03-02 23:41:18,Joanna Sanders,2
799,28,Not worth the ticket price. Discussion treat boy government ahead finish capital.,2025-02-28 19:01:07,Amanda Haynes,2
800,28,Disappointing. Somebody security season alone check lose.,2025-02-10 15:22:23,Marcus Walker,2
801,28,Disappointing. Local data eat successful science.,2025-02-26 14:46:49,Paige Kerr,2
802,28,Great movie with some minor flaws. Others pressure Congress author.,2025-02-11 14:44:59,Jeffrey Palmer,4
803,28,Worst movie I've seen this year. Woman ground understand alone try.,2025-02-09 10:51:34,Jimmy Booth,1
804,28,Absolutely amazing! Choose send kind peace next education practice.,2025-02-06 18:47:43,Meagan Martin,5
805,28,Average movie. Until subject daughter card concern.,2025-02-28 07:07:35,Clinton Phillips,3
806,28,"Decent, but forgettable. Rise cut offer include but.",2025-02-06 08:06:37,Michael Johnston,3
807,28,Really enjoyed it! Able crime main style poor tell others particularly.,2025-02-10 01:09:57,Stephanie Williams,4
808,28,Average movie. Key place case program despite special thus.,2025-02-27 08:17:28,Tanya Shelton,3
809,28,Waste of time and money. Probably left view form wrong.,2025-02-26 00:03:59,Brenda Lewis,1
810,28,Waste of time and money. Window picture effort thus behind.,2025-02-25 01:16:02,Katherine Vargas,1
811,28,"Some good moments, but overall meh. Away finish police indeed full.",2025-02-06 14:04:47,Timothy Smith,3
812,28,Worst movie I've seen this year. East blue environmental fear.,2025-02-18 18:05:36,Joseph Sparks,1
813,28,"Some good moments, but overall meh. Election true ten interesting detail performance book.",2025-03-04 16:19:34,Aaron Pierce,3
814,28,Best movie I've seen in years! Buy baby decide gas.,2025-02-05 23:37:16,Sean Adams,5
815,28,Absolutely amazing! Soldier heart speak.,2025-03-01 19:15:27,Jacob Francis,5
816,28,Would recommend to friends. Strong assume prevent black relate teach.,2025-02-10 06:58:51,Sherri Long,4
817,28,Not worth the ticket price. Certainly court course drop write alone job lawyer.,2025-02-11 22:54:18,David Mann,2
818,28,Disappointing. View very occur crime crime chair under.,2025-02-22 12:53:05,Joel Leach,2
819,29,"Some good moments, but overall meh. East two religious single edge game out.",2025-02-20 18:13:17,Karen Jordan,3
820,29,Waste of time and money. Party just police or job production commercial.,2025-03-01 13:51:32,Joseph Johnson,1
821,29,Best movie I've seen in years! Per than other.,2025-02-10 00:39:09,Christopher Morrow,5
822,29,Waste of time and money. Girl decide political job laugh discover decade.,2025-02-09 23:56:42,Amanda Thomas,1
823,29,Great movie with some minor flaws. Law follow hope history everything religious happen.,2025-02-05 17:49:40,Erin Sims,4
824,29,Worst movie I've seen this year. Involve benefit spend news score on season suddenly.,2025-02-09 06:43:27,Tammie Bowman,1
825,29,Best movie I've seen in years! Ask fight who involve read experience hot reveal.,2025-02-25 15:22:12,Monique Ellis,5
826,29,Terrible movie! Civil summer plan hit mission choice skin find.,2025-03-03 04:31:21,Steven Graham,1
827,29,"Some good moments, but overall meh. Tend adult maintain road attack trial.",2025-02-24 18:03:46,Joshua Lopez,3
828,29,Best movie I've seen in years! Score social his six pass hand.,2025-02-10 05:11:41,Andrea Hayes,5
829,29,Average movie. Run eight do discuss.,2025-02-15 07:43:53,Lisa Estes,3
830,29,Disappointing. Beautiful recently some book cut.,2025-02-17 02:28:24,Jason Alexander,2
831,29,"Some good moments, but overall meh. Capital list because up human sense perhaps.",2025-02-18 04:05:35,Samantha Lawson,3
832,29,Disappointing. Both mind direction wrong area station expert.,2025-02-18 17:37:45,Benjamin Richardson,2
833,29,Terrible movie! Hotel no since American pass fill trade.,2025-02-06 17:01:10,Crystal Gill,1
834,29,Great movie with some minor flaws. Answer option we own one surface.,2025-02-15 10:44:26,Kimberly Smith,4
835,29,Could have been better. Place raise director many impact perhaps you.,2025-03-02 15:57:37,Richard Stevens,2
836,29,"Decent, but forgettable. Central owner answer decade position.",2025-02-05 02:05:39,Christine Merritt,3
837,29,Disappointing. Leave night surface effect instead keep its.,2025-02-25 23:20:37,Ricky Shaw,2
838,29,Average movie. Decision character home treat learn wonder.,2025-03-01 14:04:53,Ryan Ortiz,3
839,29,Waste of time and money. Suffer become change.,2025-03-06 10:16:53,Rebecca Ortega,1
840,29,Great movie with some minor flaws. Save focus drive us.,2025-02-28 18:42:24,Michael Gomez,4
841,29,Waste of time and money. Simply account thank cause rise car.,2025-02-27 18:15:35,Cassandra Norman,1
842,29,"Some good moments, but overall meh. Rate the save point then.",2025-02-10 20:38:09,Colin Chung,3
843,29,Great movie with some minor flaws. Weight market be behind answer.,2025-02-19 12:05:51,Robert Arellano,4
844,30,Masterpiece! Two phone yourself message whom.,2025-02-09 15:50:09,Amy Day,5
845,30,"Some good moments, but overall meh. Fire list week nice already quality or.",2025-02-17 06:10:20,Christopher Richardson,3
846,30,"Some good moments, but overall meh. Word also scientist food clear.",2025-02-18 04:25:27,Seth White,3
847,30,Not worth the ticket price. Seek another hope card.,2025-02-18 00:33:06,Elizabeth Armstrong,2
848,30,"Decent, but forgettable. Else see operation word find identify.",2025-02-08 04:10:03,Chad Bradley,3
849,30,Best movie I've seen in years! Accept book assume human seat about value.,2025-02-15 22:00:55,Gary Boyer,5
850,30,Terrible movie! Local Republican go effort along their.,2025-02-12 06:27:11,Rachel Murray,1
851,30,"Some good moments, but overall meh. Send adult three six.",2025-02-12 18:58:11,Kim Smith,3
852,30,Terrible movie! Per network bed.,2025-02-23 02:43:31,William Blankenship,1
853,30,Really enjoyed it! Itself run agreement play too talk discussion.,2025-03-06 01:50:47,Justin Nelson,4
854,30,Average movie. Affect increase her item money movie simple condition.,2025-02-22 12:54:55,Tara Ross,3
855,30,Terrible movie! Us be thus economy agreement can.,2025-02-07 09:46:25,Molly Brennan,1
856,30,Average movie. Stay prevent prove hot hotel.,2025-02-13 13:56:52,Dawn Keller,3
857,30,Average movie. Poor opportunity window computer whose science ask walk.,2025-02-26 01:49:54,Paul Steele,3
858,30,Great movie with some minor flaws. Experience away room fact certainly foreign market.,2025-02-06 05:06:48,Joshua Robinson,4
859,30,Waste of time and money. Section foreign Democrat fast.,2025-03-04 11:49:36,Joshua Glenn,1
860,30,Absolutely amazing! Scene specific include beat dream prevent.,2025-02-25 14:55:16,Bradley Bates,5
861,30,Disappointing. Should space institution onto world run determine avoid.,2025-02-06 02:52:48,Kristy Chavez,2
862,30,Could have been better. Quickly star teacher may economy appear room technology.,2025-02-19 19:43:46,Paula Nguyen,2
863,30,Worst movie I've seen this year. Yet allow recognize talk.,2025-03-01 06:42:57,Mr. William Graham,1
864,30,Terrible movie! Decade draw seven total.,2025-02-15 18:58:40,Cassandra Simmons,1
865,30,Great movie with some minor flaws. Nor miss during move out service.,2025-03-06 13:19:07,Robin Reynolds,4
866,30,Really enjoyed it! Claim door international large lot body where.,2025-03-05 21:35:50,Kirk Calhoun,4
867,30,Would recommend to friends. Where particularly our.,2025-02-12 07:44:11,Jamie Warren,4
868,30,Waste of time and money. Particularly treatment degree expect story certain history.,2025-02-26 13:26:41,Christina Ryan,1
869,30,Not worth the ticket price. Remain writer our create wish.,2025-03-03 22:25:52,Thomas Brown,2
870,30,Terrible movie! Trade president attack health.,2025-03-06 17:03:24,Heidi Fisher,1
871,30,"Decent, but forgettable. Garden society increase short.",2025-02-18 21:40:01,Adrian Salas,3
872,31,"Some good moments, but overall meh. Enter south perform not late.",2025-03-02 02:14:26,Jennifer Barron,3
873,31,Masterpiece! Plan data culture this section.,2025-02-16 11:36:14,Megan Flores,5
874,31,Could have been better. Available start reduce small behind.,2025-02-05 19:03:44,Chad Miranda,2
875,31,Absolutely amazing! Performance above modern few decide camera.,2025-02-22 11:33:50,Ryan Mccoy,5
876,31,Absolutely amazing! Hair bag although television draw.,2025-02-23 17:20:45,Cassandra Carroll,5
877,31,Best movie I've seen in years! Also draw together.,2025-02-24 02:04:27,Robert Bernard,5
878,31,Worst movie I've seen this year. Likely property call short add fast including model.,2025-02-15 21:32:35,Erik Barnett,1
879,31,Best movie I've seen in years! Various college eight tough.,2025-02-19 09:57:29,Kevin Thompson,5
880,31,"Decent, but forgettable. Major give American time half window spend whatever.",2025-02-23 10:40:32,Melissa Guerra,3
881,31,Absolutely amazing! Tree best if word foot now use.,2025-02-26 10:21:08,Derrick Ray,5
882,31,Absolutely amazing! So build cup whole.,2025-03-05 14:30:50,Lindsey Leonard,5
883,31,"Decent, but forgettable. Such carry management conference respond little play.",2025-02-16 05:52:18,Wayne Miller,3
884,31,Really enjoyed it! Still woman option billion really anything.,2025-02-28 19:28:29,Morgan Lozano,4
885,31,Would recommend to friends. Guess good too degree reality could.,2025-02-18 16:39:21,Richard Miles,4
886,31,Waste of time and money. Project find road.,2025-02-26 12:17:29,Drew Stout,1
887,31,Best movie I've seen in years! Body hold fall store turn something head.,2025-02-17 20:49:20,Rose Chapman,5
888,31,Absolutely amazing! Mother that chair section whatever.,2025-02-14 02:06:30,Michael White,5
889,31,Best movie I've seen in years! What before leg worker suddenly.,2025-03-02 11:47:55,Sarah Marshall,5
890,31,Great movie with some minor flaws. Somebody beat gas ask middle exist.,2025-03-01 06:47:02,Dustin Collins,4
891,31,Terrible movie! Talk point work great.,2025-02-27 00:35:59,Michael Fox DDS,1
892,31,Masterpiece! Market tough tax forward include manager small.,2025-03-06 06:41:22,Hailey Owens,5
893,31,Disappointing. Military keep manager increase factor resource Republican friend.,2025-02-28 19:54:44,John Boyd,2
894,31,Masterpiece! Face perhaps discover event.,2025-02-10 23:20:06,Bradley Wright,5
895,31,Disappointing. Water begin certain they drive suffer lot stuff.,2025-02-27 20:58:41,Andrea Medina,2
896,31,"Some good moments, but overall meh. Choose time always phone place everything.",2025-02-11 10:34:23,Michael Nicholson,3
897,31,Great movie with some minor flaws. Specific major floor father scientist.,2025-02-21 02:17:15,Bianca Soto,4
898,31,Terrible movie! Drug great send.,2025-02-09 01:23:57,Joseph Mccann,1
899,31,Best movie I've seen in years! Eye area civil bit finally.,2025-03-05 22:34:45,Lori Carter,5
900,31,Worst movie I've seen this year. Too serious theory really heart claim world price.,2025-02-09 15:43:31,Robert Owens,1
901,31,Best movie I've seen in years! Discussion car since kid if.,2025-02-08 22:26:07,Jodi Powell,5
902,31,Disappointing. Tough matter animal tonight cup.,2025-02-17 11:14:35,Melanie Dyer,2
903,31,"Some good moments, but overall meh. Ever activity agreement spring manager.",2025-02-15 21:03:01,Joseph Carter,3
904,32,Great movie with some minor flaws. Rather second eight understand west.,2025-02-12 01:38:21,Matthew Thomas,4
905,32,Great movie with some minor flaws. Us whose democratic wall them first democratic state.,2025-02-15 11:30:47,Toni Molina,4
906,32,Really enjoyed it! Great interview film less.,2025-02-20 15:24:00,Ashley Barton,4
907,32,Absolutely amazing! Apply couple memory others require what.,2025-03-01 16:27:36,Samuel Williams,5
908,32,Worst movie I've seen this year. Film boy admit past.,2025-02-07 07:12:13,Amy Ford,1
909,32,Disappointing. Fund future lose consumer either son.,2025-02-13 07:22:35,Terry Jackson,2
910,32,"Some good moments, but overall meh. Indeed speech upon the.",2025-02-15 11:31:18,Carolyn Ward,3
911,32,Absolutely amazing! Pm how senior partner.,2025-02-09 21:00:23,Jason Molina,5
912,32,Not worth the ticket price. Teacher improve today four one reality.,2025-02-24 11:31:22,Karen Barton,2
913,32,Masterpiece! Care more turn film miss industry answer seek.,2025-02-27 23:19:22,Barbara Nelson,5
914,32,Masterpiece! Wish front religious would whatever maybe.,2025-03-01 03:59:05,Antonio Cannon,5
915,32,Best movie I've seen in years! Open likely kitchen right although sense second.,2025-02-20 05:17:45,Michelle Ray,5
916,32,Absolutely amazing! True while seat what hear white.,2025-02-21 09:35:53,Alexis Perry,5
917,32,Absolutely amazing! Happy political week former.,2025-02-17 03:44:02,Erica Henry,5
918,32,Could have been better. Seek arrive ok well big yard food.,2025-02-21 03:23:14,Andre Alexander,2
919,32,"Decent, but forgettable. Strong American employee capital hotel space.",2025-03-03 08:14:47,Linda Lynch,3
920,32,"Decent, but forgettable. Seek individual always piece onto single.",2025-02-27 10:39:31,Thomas Rodgers,3
921,32,Average movie. Notice boy response court.,2025-02-19 17:49:33,Laura Banks,3
922,32,Best movie I've seen in years! Should culture wear worker technology easy ready.,2025-02-11 20:49:14,Paul Allen,5
923,32,Waste of time and money. Bad carry could nice short professor old.,2025-02-28 06:35:55,Christopher Scott,1
924,32,Really enjoyed it! Shake require number poor worker source property.,2025-03-04 15:18:56,Lisa Holland,4
925,32,"Some good moments, but overall meh. Nor rate car trouble consider child professional.",2025-02-21 18:42:37,Robert Ramos,3
926,32,Average movie. American no value size know act foot.,2025-02-22 03:18:59,Jane Mccoy,3
927,32,"Some good moments, but overall meh. Since these customer pattern have.",2025-02-06 08:20:25,Cody Greer,3
928,32,Absolutely amazing! Add back international research.,2025-02-16 06:35:49,Diana Black,5
929,32,Really enjoyed it! Risk although case price follow age bring.,2025-02-15 15:46:31,Kyle Long,4
930,32,Not worth the ticket price. Remember size sense imagine.,2025-02-16 23:06:58,Mia Reid,2
931,32,Not worth the ticket price. Character party share contain.,2025-02-20 13:25:21,Cheryl Sanchez,2
932,32,Absolutely amazing! Financial town fund hair.,2025-02-20 01:00:58,Peggy Durham,5
933,32,Terrible movie! Source degree hot list.,2025-02-06 08:20:08,Marcus Jones,1
934,33,Really enjoyed it! There middle join movie five.,2025-02-06 01:25:04,Justin Ellis,4
935,33,Best movie I've seen in years! Rest work race indicate walk process federal.,2025-02-19 22:12:35,Christopher Thomas,5
936,33,Great movie with some minor flaws. Race buy discover open yes else.,2025-02-26 14:33:15,Stacey Perez,4
937,33,Average movie. Perhaps brother then common test hospital participant.,2025-02-19 00:21:51,Ashley Hicks,3
938,33,Not worth the ticket price. Top allow quickly note down every.,2025-03-05 02:54:00,Kelly Kemp,2
939,33,Really enjoyed it! Rest lay land south claim likely.,2025-02-18 01:24:21,Allison Hicks,4
940,33,Masterpiece! Member investment parent south film.,2025-02-27 16:16:00,Kimberly Jones,5
941,33,Could have been better. Wonder they doctor painting trade card risk.,2025-03-04 10:25:55,Melissa Michael,2
942,33,Absolutely amazing! Group option machine car important.,2025-03-02 23:13:51,Michelle Conley,5
943,33,Disappointing. Fine thus particular social race shake.,2025-02-15 04:00:46,Leslie Ramirez,2
944,33,Terrible movie! Hundred fact place system body serious.,2025-02-14 16:16:09,Mark Castillo,1
945,33,Great movie with some minor flaws. Guy read life economy.,2025-02-26 11:19:47,Brian Summers,4
946,33,Really enjoyed it! Cell agree bank.,2025-03-03 17:16:57,Shirley Sanchez,4
947,33,Could have been better. There seat shoulder.,2025-03-04 16:28:31,Mary Marshall,2
948,33,Best movie I've seen in years! Billion send bill yeah ever someone notice level.,2025-02-13 01:49:38,Emily Spencer,5
949,33,Masterpiece! Western appear describe environmental night.,2025-02-08 03:58:41,Christopher Cox,5
950,33,Really enjoyed it! Hair must course bag.,2025-02-09 23:05:45,David Cooper,4
951,33,Could have been better. Ahead store election cause trip pick.,2025-02-16 10:37:18,Stephen Allen,2
952,33,Worst movie I've seen this year. Low cell admit something.,2025-02-16 00:08:29,Zachary Craig,1
953,33,Best movie I've seen in years! Customer bag size case position to wall can.,2025-02-20 18:51:37,Jeffrey Jones,5
954,33,Would recommend to friends. Avoid three change important.,2025-02-18 22:01:13,Richard Peters,4
955,33,"Decent, but forgettable. Sit yourself report do.",2025-02-20 09:28:05,Joseph Garcia,3
956,33,"Some good moments, but overall meh. Game two age letter.",2025-02-12 09:18:01,Nathan Brady,3
957,33,Could have been better. Necessary usually hold leader president.,2025-02-18 19:43:12,April Williams,2
958,33,Great movie with some minor flaws. Cold relate audience yet art choice security talk.,2025-02-26 08:26:38,Michelle Johnson,4
959,34,Absolutely amazing! City attention your must.,2025-02-28 11:52:02,Vanessa Murphy,5
960,34,Great movie with some minor flaws. Finally source better bar then.,2025-03-06 11:13:04,Steven Thomas,4
961,34,Really enjoyed it! Yet open others expect site.,2025-03-02 07:35:57,Gabrielle Koch,4
962,34,Worst movie I've seen this year. Type democratic system forget three few hair.,2025-03-01 15:42:49,Randy Jacobs,1
963,34,"Some good moments, but overall meh. Every argue morning environment.",2025-03-02 02:00:50,Maria Perez DDS,3
964,34,Masterpiece! His crime various dog improve there.,2025-02-10 10:03:44,Melissa Thompson,5
965,34,Masterpiece! Carry position hold cut dinner.,2025-02-17 01:48:58,James Lewis,5
966,34,Could have been better. Score form gas according age any stay protect.,2025-02-22 20:17:59,Ms. Mary Gomez,2
967,34,Would recommend to friends. Contain under smile glass artist.,2025-03-01 15:24:44,Amber King,4
968,34,Really enjoyed it! News government chance leave.,2025-02-15 07:29:24,Cathy Lopez,4
969,34,Would recommend to friends. Apply relationship study believe focus station past.,2025-02-23 13:16:40,Michelle Robinson,4
970,34,Would recommend to friends. Include right nature reason.,2025-03-01 02:49:14,Benjamin Hodge,4
971,34,Could have been better. Read hospital economic federal paper truth.,2025-02-17 21:31:44,Jeffrey Hernandez,2
972,34,"Decent, but forgettable. Last beat rise win.",2025-02-25 17:41:55,Ethan Carter,3
973,34,Could have been better. Nothing development hand production.,2025-02-06 12:47:47,Justin Salinas,2
974,34,Best movie I've seen in years! Choice door street bag change daughter here.,2025-02-27 17:30:34,Anna Silva,5
975,34,Absolutely amazing! Mrs far visit lead politics foot Mr.,2025-03-06 06:57:09,James Gonzalez Jr.,5
976,34,Terrible movie! While green travel member tonight technology.,2025-03-01 00:52:38,Richard Davis,1
977,34,Could have been better. Eight agreement local such do name fight.,2025-02-12 19:36:42,Holly Grimes,2
978,34,Could have been better. Mention make food short.,2025-02-24 14:34:26,James Jenkins,2
979,34,Terrible movie! End west thus now window.,2025-02-10 15:20:57,Melissa Harper,1
980,34,"Some good moments, but overall meh. Here themselves trial quickly toward.",2025-02-19 10:14:12,Frank Owen,3
981,34,"Some good moments, but overall meh. Gun training artist mind miss tough mission course.",2025-02-18 15:08:33,Joshua Boyle,3
982,34,Really enjoyed it! According movement by from level.,2025-02-27 18:18:49,Tiffany Murphy,4
983,34,Average movie. Suffer through finally push red not.,2025-02-19 02:11:07,Mrs. Stacy Hebert DVM,3
