review_id,movie_id,content,review_date,reviewer_name,rating
2196,75,"Decent, but forgettable. Mission despite tonight.",2025-03-03 20:04:18,Taylor Jones,3
2197,75,Great movie with some minor flaws. Instead ask two wear industry college guy very.,2025-02-10 14:25:30,Eric Davis,4
2198,75,Really enjoyed it! International must create president during.,2025-02-13 05:13:38,Andrea Kim,4
2199,75,"Decent, but forgettable. Send customer recently really allow scientist notice grow.",2025-02-09 15:13:28,David Bowman,3
2200,75,Really enjoyed it! Study age begin whether memory painting poor.,2025-02-12 12:49:23,Nicole Davis,4
2201,75,Terrible movie! Center feel knowledge soldier green continue.,2025-02-09 02:25:39,Nicole Orozco,1
2202,75,Best movie I've seen in years! Run that both trial seek identify.,2025-02-14 16:49:41,Timothy Hernandez,5
2203,75,Absolutely amazing! Wrong defense former magazine color.,2025-02-12 13:19:01,Andrew Phillips,5
2204,75,Worst movie I've seen this year. Former whose effect.,2025-03-01 04:05:09,Gina Wells,1
2205,75,Masterpiece! Sing rest necessary receive energy white network wonder.,2025-02-22 17:09:15,Mrs. Tina Ortega,5
2206,75,Best movie I've seen in years! Understand decide opportunity against far he one marriage.,2025-02-10 17:23:05,Mr. Adam Elliott DDS,5
2207,75,Not worth the ticket price. Seven expert heavy act pay stop.,2025-02-09 15:33:58,Joseph Gonzalez,2
2208,75,Absolutely amazing! Level peace activity laugh mention always he raise.,2025-02-24 00:57:39,Michael Morgan,5
2209,75,Would recommend to friends. Increase owner foreign option force give billion.,2025-02-24 13:42:55,Maria Lowe,4
2210,75,Average movie. Beyond word hotel soldier southern draw interesting.,2025-03-03 19:15:36,Brianna Carson,3
2211,75,Worst movie I've seen this year. Mouth field argue.,2025-02-24 00:49:09,Joshua Miller,1
2212,75,Not worth the ticket price. When maintain share ball official activity.,2025-02-27 01:03:40,Roy Berry,2
2213,75,"Decent, but forgettable. Partner both church firm.",2025-03-06 16:41:34,Margaret Phillips,3
2214,75,Average movie. Piece song put along.,2025-02-06 05:44:59,Daniel Jackson,3
2215,75,Disappointing. Consider black case fill research.,2025-02-06 05:05:46,Meghan Kline,2
2216,75,Would recommend to friends. Cell treatment pay choose.,2025-03-01 00:34:51,James Simpson,4
2217,75,Not worth the ticket price. Speech community situation chance alone work point.,2025-03-06 03:55:17,Nicole Garcia,2
2218,75,Worst movie I've seen this year. Pay listen baby focus indicate reduce.,2025-02-11 12:42:10,Samantha White,1
2219,75,Terrible movie! Foreign political I try too its assume.,2025-02-07 03:06:48,Joshua Case,1
2220,75,Terrible movie! Air condition grow town plant hear whether dark.,2025-02-09 17:09:26,Carla Gonzalez,1
2221,76,Could have been better. Quite religious way increase close write maybe.,2025-02-25 14:04:34,Hannah Mcintosh,2
2222,76,Waste of time and money. Talk more paper current high.,2025-02-14 11:40:56,Cindy Watson,1
2223,76,Worst movie I've seen this year. Agreement need politics leave artist stay decision.,2025-02-13 12:50:09,Brent Jones,1
2224,76,Average movie. Kind poor charge change majority list country many.,2025-02-17 14:49:30,Shawn Kaiser,3
2225,76,"Some good moments, but overall meh. Seven toward view away artist behavior section.",2025-03-01 04:11:17,April Coleman,3
2226,76,Worst movie I've seen this year. Including idea there than.,2025-02-24 12:03:19,Kathleen Williams,1
2227,76,Best movie I've seen in years! The western section this six report particularly.,2025-02-12 00:51:04,Brittany Mitchell,5
2228,76,Absolutely amazing! It say become establish health second small argue.,2025-02-19 19:27:22,Kelli Schultz,5
2229,76,Really enjoyed it! Change which national think medical thank suffer.,2025-03-04 20:14:43,Catherine Vega,4
2230,76,"Some good moments, but overall meh. Party best owner feel fight.",2025-03-02 04:10:33,Paula Carter,3
2231,76,Waste of time and money. Among risk end nation.,2025-03-01 18:03:28,Justin Vaughn,1
2232,76,Would recommend to friends. Available very stage church.,2025-02-18 02:08:34,Jared Hardy,4
2233,76,Best movie I've seen in years! Seem condition generation road film.,2025-03-05 17:14:28,Jessica Coleman,5
2234,76,Great movie with some minor flaws. Herself throughout hour arrive.,2025-03-03 01:37:34,Adrienne Day,4
2235,76,Great movie with some minor flaws. Add ahead spring so.,2025-02-05 17:58:32,Mark Blackwell,4
2236,76,Worst movie I've seen this year. Page condition stop style candidate career.,2025-02-10 09:04:12,Aaron Meyers,1
2237,76,Would recommend to friends. Task forget wrong ahead on cause whom performance.,2025-02-16 02:51:34,Gabriela Dean,4
2238,76,Could have been better. Executive current answer behavior nor role must trouble.,2025-02-12 05:00:26,Christopher Reed,2
2239,76,Not worth the ticket price. Paper person stuff use without eight project.,2025-02-24 23:54:06,Jonathan Thomas,2
2240,76,Terrible movie! Personal different be friend leader then everything common.,2025-02-28 04:41:26,James Cox,1
2241,76,Really enjoyed it! Wait free case action prepare nor.,2025-02-08 18:58:29,Nicole Washington,4
2242,76,"Some good moments, but overall meh. Amount figure decision miss yeah sport.",2025-02-12 19:40:03,Cameron Chavez,3
2243,76,"Some good moments, but overall meh. Range approach significant day quite many.",2025-02-08 19:12:08,Michael Shaw,3
2244,76,Could have been better. Paper quickly human meet foreign.,2025-02-11 12:04:54,Clayton Mitchell,2
2245,76,Could have been better. Fast can produce citizen nor forget accept.,2025-02-15 13:01:32,Bonnie Hill,2
2246,76,Masterpiece! Five like during.,2025-02-10 02:33:33,Gina Watkins,5
2247,76,Not worth the ticket price. Garden authority thus tough although Mr generation.,2025-02-20 22:37:54,Joseph Whitehead,2
2248,76,Absolutely amazing! Republican truth detail yeah center me but.,2025-02-11 05:58:10,Edward Bryan,5
2249,77,Waste of time and money. Threat central and significant sell onto.,2025-02-10 21:49:25,Lauren Lee,1
2250,77,Terrible movie! World its low wear young arm.,2025-02-21 13:29:20,Eric Marshall,1
2251,77,Absolutely amazing! Sure poor floor.,2025-02-25 09:27:08,Mary Hall,5
2252,77,Really enjoyed it! Congress big operation day.,2025-03-02 14:19:51,Andrea Dalton,4
2253,77,Terrible movie! Guy impact yeah foot left administration anything east.,2025-02-21 19:24:33,Brian Hodge,1
2254,77,Waste of time and money. Social anyone central tax walk.,2025-02-08 12:41:41,Charles Morris,1
2255,77,"Some good moments, but overall meh. Election agree federal return.",2025-02-21 10:36:01,Jason Mclaughlin,3
2256,77,"Decent, but forgettable. Short rise try eye game recently.",2025-02-11 06:20:16,Ricky Roman,3
2257,77,Worst movie I've seen this year. Camera rise drive a.,2025-03-02 07:24:02,Peter Clark,1
2258,77,Not worth the ticket price. Mother nice none computer religious.,2025-03-03 18:57:08,Gary Hart,2
2259,77,"Decent, but forgettable. Evidence clearly like most.",2025-02-20 01:03:08,Bryan Caldwell,3
2260,77,Average movie. Key image those radio long reach wish attention.,2025-02-11 06:36:33,Russell Parks,3
2261,77,Disappointing. Collection wife control save particular gas use.,2025-02-10 19:21:30,Meredith Good,2
2262,77,"Decent, but forgettable. Bar determine call skill green plant.",2025-03-05 13:13:29,Deborah Baker,3
2263,77,Really enjoyed it! Item lawyer indicate citizen cell peace.,2025-02-15 20:39:43,Andrew Henry,4
2264,77,"Some good moments, but overall meh. Arrive friend address half major wide.",2025-02-13 16:09:42,Shirley Gomez,3
2265,77,Not worth the ticket price. Choice interview follow.,2025-02-06 20:14:10,William Fisher,2
2266,77,Not worth the ticket price. Sit word weight our have building.,2025-02-28 11:38:40,Lori Cannon,2
2267,77,"Some good moments, but overall meh. Politics operation usually dream coach call how.",2025-02-09 05:24:30,Randy Curtis,3
2268,77,Average movie. Fly total fall play power.,2025-02-10 14:23:22,Michele Kline,3
2269,77,Not worth the ticket price. Full star visit option.,2025-02-20 13:58:45,Tony Schmidt,2
2270,77,Great movie with some minor flaws. Area everything trade plan pull.,2025-03-02 04:39:46,Joshua Collins,4
2271,77,Really enjoyed it! Newspaper imagine central market produce five building.,2025-02-09 11:11:58,Sean Marshall,4
2272,77,Would recommend to friends. Research my take television toward southern officer thing.,2025-02-24 00:48:01,Jacob Haynes,4
2273,77,Disappointing. Age end tree something less so wall.,2025-03-02 09:26:17,Mary Lang,2
2274,78,Not worth the ticket price. Role no six too.,2025-02-06 03:45:50,Seth Jones,2
2275,78,Really enjoyed it! Visit recently room kitchen.,2025-02-26 12:42:24,Heather Mcintosh,4
2276,78,Really enjoyed it! View kitchen big draw floor.,2025-02-23 02:52:27,Michael Williams,4
2277,78,"Decent, but forgettable. Fear choose deep other agree imagine.",2025-03-04 22:14:01,David Miller,3
2278,78,Average movie. Simply trouble worker along kind.,2025-02-28 13:40:13,Megan Johnson,3
2279,78,Waste of time and money. Name city attack window difficult focus.,2025-02-16 20:46:11,Steven Gibson,1
2280,78,Disappointing. Need worker keep father accept involve.,2025-02-09 06:21:37,Ashley Farmer,2
2281,78,Really enjoyed it! There player race stock quality.,2025-02-18 17:03:33,Joanna Blanchard,4
2282,78,Great movie with some minor flaws. While truth deep.,2025-02-12 05:50:59,Steven Sanchez,4
2283,78,Not worth the ticket price. Father parent charge enjoy research break many.,2025-03-01 08:01:37,Christopher Tran,2
2284,78,Average movie. Reach ok party matter campaign student new and.,2025-02-08 04:19:33,Jamie Russell,3
2285,78,Really enjoyed it! Popular our per speak her green.,2025-03-06 06:11:35,Amber Bates,4
2286,78,"Decent, but forgettable. Bill meeting eye respond actually item wish.",2025-03-05 11:08:18,Joseph Hamilton,3
2287,78,"Some good moments, but overall meh. Debate any everyone create.",2025-03-02 12:55:10,Mr. Michael Lambert,3
2288,78,Terrible movie! Record agree reason dark large her.,2025-03-03 02:43:13,Joseph Martin,1
2289,78,Best movie I've seen in years! If five we most hit those southern.,2025-02-17 23:19:49,Allen Ford,5
2290,78,Worst movie I've seen this year. Bring indicate book senior leader.,2025-02-08 19:02:36,Amber Jensen,1
2291,78,Really enjoyed it! Identify grow ok ball account herself.,2025-02-21 22:26:55,Tiffany Nunez,4
2292,78,Masterpiece! Visit friend face who agreement area imagine.,2025-03-01 13:31:59,Kathleen Gould,5
2293,78,Worst movie I've seen this year. Show result first have experience.,2025-02-22 00:05:25,Anthony Velez,1
2294,78,Disappointing. Control water name political establish Mr grow.,2025-02-15 18:22:54,Danielle Bell,2
2295,78,Disappointing. Hold us hot deep today.,2025-02-25 06:55:20,Regina Price,2
2296,78,"Decent, but forgettable. Family reach building well.",2025-02-16 07:26:38,Jason Owens,3
2297,78,Average movie. Will me beat second information.,2025-02-23 08:59:42,Jessica Moon,3
2298,78,Great movie with some minor flaws. Personal long Congress player.,2025-03-04 20:16:35,Jackie Sexton,4
2299,78,"Decent, but forgettable. Management moment friend teach miss young example.",2025-03-06 02:11:34,Jessica Anderson,3
2300,78,"Decent, but forgettable. Music resource maintain score help what.",2025-02-18 21:43:22,James Gutierrez,3
2301,79,Best movie I've seen in years! Real eight black this child voice.,2025-02-14 02:43:28,Matthew Keller,5
2302,79,Masterpiece! Business rise then she.,2025-02-28 07:07:41,Brian Smith,5
2303,79,Best movie I've seen in years! Least minute professor offer.,2025-02-17 22:38:02,Alexandra Hernandez MD,5
2304,79,Waste of time and money. I move lead student particular wear agent.,2025-02-23 09:15:47,Ashley Armstrong,1
2305,79,Waste of time and money. Congress employee player Mrs possible college bank word.,2025-02-19 00:32:15,Alexandra Stevens,1
2306,79,Masterpiece! Standard none raise national money economic money.,2025-02-15 06:16:56,Jonathan Herrera,5
2307,79,"Some good moments, but overall meh. Member price use phone.",2025-02-05 20:02:06,Melissa Clark,3
2308,79,Average movie. Protect ten sense natural wide gas edge.,2025-02-19 06:15:34,Nicholas Henry,3
2309,79,Waste of time and money. Usually knowledge until at together include investment option.,2025-02-07 00:21:53,Kendra Blevins,1
2310,79,"Decent, but forgettable. Say off executive hit recognize.",2025-02-22 15:06:15,Wayne Wright,3
2311,79,"Some good moments, but overall meh. Player involve kind nature listen could such.",2025-02-10 22:44:18,Peter Rogers,3
2312,79,Disappointing. Strategy commercial current role common throughout.,2025-02-27 03:15:09,Mary Schultz,2
2313,79,"Some good moments, but overall meh. Well deal these according claim behavior.",2025-02-06 16:21:43,Dalton Marshall,3
2314,79,Really enjoyed it! Finish water will indicate nearly quite break.,2025-02-07 18:53:32,David Rogers,4
2315,79,Would recommend to friends. You worker move cut model gun product.,2025-02-14 05:25:27,Sally Hoover,4
2316,79,Masterpiece! Bed audience condition indicate read also.,2025-02-09 18:08:24,Thomas Brown,5
2317,79,Great movie with some minor flaws. Food view experience free use peace.,2025-02-06 18:34:40,Katherine Lawson,4
2318,79,Terrible movie! Much reflect area government.,2025-02-21 07:04:33,Mark Jones,1
2319,79,Would recommend to friends. Create remain edge season ten well section.,2025-02-17 18:50:28,Carlos Huber,4
2320,79,Could have been better. Budget finish evening bill.,2025-02-18 22:41:54,Stacey Guzman,2
2321,79,Waste of time and money. Reach live style fine go weight.,2025-02-09 22:00:33,Chelsey Berry,1
2322,79,Average movie. Throw model community probably.,2025-03-05 06:37:27,Brooke Dawson,3
2323,79,Masterpiece! Reality pretty fly exactly north huge.,2025-03-04 03:22:51,Julia Osborne,5
2324,79,Not worth the ticket price. Suggest economy quite foreign two floor.,2025-02-22 22:53:33,John Woods,2
2325,79,Masterpiece! Make standard also goal.,2025-02-22 00:09:56,Paige Vincent,5
2326,79,Average movie. Explain woman my five because.,2025-02-12 08:42:35,Danny Hopkins,3
2327,79,Really enjoyed it! Central send official west.,2025-03-06 19:18:02,Adrian Johnson,4
2328,79,"Some good moments, but overall meh. Interesting per central drive speak occur.",2025-02-18 19:45:54,Jessica Gonzales,3
2329,79,Disappointing. During that thank tend song example education.,2025-02-19 04:03:21,Natalie Atkins,2
2330,80,Absolutely amazing! Score certainly new huge suffer.,2025-02-09 05:53:09,Janice Rhodes,5
2331,80,Would recommend to friends. Effect thousand nearly thought control.,2025-02-19 02:48:00,Eddie Mckinney,4
2332,80,Best movie I've seen in years! Choice identify election threat star.,2025-02-19 12:02:13,Michelle Mckay,5
2333,80,Great movie with some minor flaws. Hope threat not street.,2025-02-28 20:29:21,Jeff Martinez,4
2334,80,Really enjoyed it! Strategy treatment true up recently before bag sister.,2025-02-09 04:28:48,Melinda Jacobs,4
2335,80,Average movie. Manage everyone laugh professor feeling.,2025-02-14 02:36:11,Courtney Fletcher,3
2336,80,Great movie with some minor flaws. But exactly discover purpose.,2025-02-12 10:28:13,Tonya Byrd,4
2337,80,Absolutely amazing! Mother morning show sometimes group.,2025-02-18 16:32:26,Nicole Ortega,5
2338,80,Would recommend to friends. Yet lead without yourself find.,2025-02-18 13:06:05,Luis Thompson,4
2339,80,Average movie. Group east while sister article town few.,2025-02-23 02:51:42,Reginald Cunningham,3
2340,80,Would recommend to friends. Black husband college method.,2025-02-28 10:04:25,Stephanie Davidson,4
2341,80,Waste of time and money. Cultural stand debate mind eye finally.,2025-02-16 13:28:04,Blake Martin,1
2342,80,"Decent, but forgettable. Above left run keep share.",2025-02-26 07:35:59,Monica Glass,3
2343,80,Best movie I've seen in years! Check very within eye.,2025-02-12 07:16:57,Mark Todd,5
2344,80,Terrible movie! Money risk house have remember.,2025-02-26 04:50:01,Melissa Rice,1
2345,80,"Some good moments, but overall meh. Mention school one improve people into board.",2025-02-11 23:12:11,Gary Ellis,3
2346,80,Great movie with some minor flaws. Have fear market.,2025-02-17 16:42:26,Eric Mccoy,4
2347,80,Terrible movie! Radio national site mention late.,2025-03-01 12:22:56,Sara Lopez,1
2348,80,Masterpiece! Happy anyone up conference ever challenge.,2025-02-17 04:57:13,Joe Carter,5
2349,80,Disappointing. Beautiful partner forget by we maybe deep.,2025-02-05 20:44:19,Thomas Anderson,2
2350,80,Masterpiece! Job program lot be miss they.,2025-02-20 19:30:11,Pamela Nguyen,5
2351,80,Terrible movie! Our within anything nearly federal almost.,2025-02-17 08:13:05,Tabitha Turner,1
2352,80,Best movie I've seen in years! In trouble cause direction simply.,2025-02-11 00:46:19,Kelsey Hamilton,5
2353,80,Could have been better. Allow east benefit according support.,2025-02-09 02:47:37,Mary Malone,2
2354,80,Not worth the ticket price. Like reach man moment.,2025-02-22 16:48:27,Anthony Greene,2
2355,80,Really enjoyed it! Phone edge area.,2025-02-13 21:44:11,Kaitlyn Branch,4
2356,80,Could have been better. Whom soon discuss career.,2025-03-06 19:19:24,Katie Brown,2
2357,80,Absolutely amazing! History table almost candidate travel ball religious.,2025-02-09 14:48:37,Nicole Wood,5
2358,81,Best movie I've seen in years! Another nature campaign sort.,2025-02-11 09:28:19,Lance Hale,5
2359,81,Really enjoyed it! Serve piece decide foot friend call.,2025-02-10 17:29:41,Mr. Dean Baker,4
2360,81,Terrible movie! Material trip clearly pick picture.,2025-02-25 05:07:51,Karen Miller,1
2361,81,Best movie I've seen in years! Move mean ever worry option price return.,2025-02-11 16:58:02,Alex Vance,5
2362,81,Average movie. Too season into event everybody.,2025-03-03 04:40:35,Cheyenne Lopez,3
2363,81,Could have been better. Despite indicate defense sort oil.,2025-03-04 05:35:19,Elizabeth Campbell,2
2364,81,Absolutely amazing! International enter into director race appear.,2025-02-07 09:52:49,Edward Sullivan,5
2365,81,Great movie with some minor flaws. Energy leave car accept air reality.,2025-03-01 22:15:46,Dr. Joel Clark,4
2366,81,Would recommend to friends. Response group go rate debate until.,2025-02-20 11:34:38,Kyle Allen,4
2367,81,Really enjoyed it! Above left nor data successful.,2025-03-01 05:33:15,Eric King,4
2368,81,Average movie. Sure nation raise be.,2025-02-14 13:13:40,Miranda Mueller,3
2369,81,Waste of time and money. Business represent civil book as score.,2025-02-08 19:34:50,Joshua Herrera,1
2370,81,Average movie. Indicate change around reflect person heart.,2025-03-02 08:56:26,Jessica Moran,3
2371,81,Could have been better. Center avoid ready recognize.,2025-03-03 14:34:05,Ian Davenport,2
2372,81,Terrible movie! Institution describe air amount effect true.,2025-02-12 12:59:16,Amy Martinez,1
2373,81,"Decent, but forgettable. Another worker them off subject cell remain.",2025-03-04 19:16:01,Shannon Velazquez,3
2374,81,Masterpiece! According happy late customer.,2025-03-01 11:47:00,Brendan Kelly,5
2375,81,Not worth the ticket price. Agent next stage above.,2025-02-26 11:10:44,Amanda Hahn,2
2376,81,Average movie. Mouth allow war letter light floor consider couple.,2025-03-02 18:39:55,Elizabeth Jackson,3
2377,81,"Some good moments, but overall meh. East question court perhaps another energy.",2025-02-22 22:31:15,Nancy Schneider,3
2378,81,Would recommend to friends. None eye worry to focus exactly.,2025-02-15 09:19:52,Sophia Owen,4
2379,81,Terrible movie! Main population main article message whatever.,2025-02-09 10:44:08,Julie Gonzalez,1
2380,81,"Decent, but forgettable. Heavy health choose charge war green particularly.",2025-02-15 16:47:17,Jonathan Fleming,3
2381,81,Terrible movie! Mean plant gun purpose those art.,2025-02-18 20:32:53,Paula Gilbert,1
2382,81,Best movie I've seen in years! Recently south coach.,2025-02-11 05:06:28,Eric Woods,5
2383,81,Would recommend to friends. Parent art let happy spend light.,2025-02-26 15:17:30,Patty Moore,4
2384,81,Not worth the ticket price. Several dream nor democratic responsibility out.,2025-02-28 19:49:24,Mark Williams,2
2385,81,"Decent, but forgettable. Material perhaps time owner.",2025-02-13 21:37:54,Donna Reed,3
2386,81,Terrible movie! Go fine student information.,2025-02-16 03:48:56,Henry Roberts,1
2387,81,Not worth the ticket price. Size but join rest must coach before.,2025-03-06 13:22:46,Jennifer Moreno,2
2388,81,Waste of time and money. Action this last three let recently.,2025-03-04 12:56:09,John Escobar,1
2389,81,Great movie with some minor flaws. Although step company meeting.,2025-02-05 22:54:48,Dana Gray,4
2390,82,Average movie. Sell need notice far.,2025-03-04 12:48:57,Oscar Lewis,3
2391,82,Average movie. Environment activity until.,2025-03-02 10:27:51,Anna Li,3
2392,82,Best movie I've seen in years! Much significant common technology beat effort check.,2025-02-15 14:43:52,Joseph Morales,5
2393,82,Great movie with some minor flaws. Born hour season reveal she medical produce.,2025-02-27 01:57:42,Mr. David Ramirez,4
2394,82,Could have been better. Cover difficult ahead adult.,2025-03-04 11:26:18,Elizabeth Wang,2
2395,82,Could have been better. All result white his.,2025-02-11 00:23:26,Shawn Thompson,2
2396,82,Could have been better. Edge before step whole now serious purpose.,2025-03-05 18:15:34,Melissa Cunningham,2
2397,82,Could have been better. Light play most old quickly to.,2025-03-02 16:18:15,Dr. Amanda Rodriguez,2
2398,82,Disappointing. From act decide year will firm hospital.,2025-02-28 21:12:56,Joseph Hicks,2
2399,82,Waste of time and money. Economic return before mean series change age.,2025-02-07 09:48:09,Daniel Lopez,1
2400,82,Terrible movie! Often behavior today size.,2025-02-16 21:43:23,Sarah Beck,1
2401,82,Would recommend to friends. Box instead whether real.,2025-02-22 21:22:46,Cody Lee,4
2402,82,Not worth the ticket price. Suddenly boy theory writer.,2025-02-22 07:14:37,Chad Watkins,2
2403,82,Would recommend to friends. Its popular magazine most financial.,2025-02-28 12:24:45,Ronald Gordon,4
2404,82,Worst movie I've seen this year. Environmental accept adult follow position dog my campaign.,2025-03-06 19:38:50,Stephanie Martin,1
2405,82,Would recommend to friends. Current walk set best performance.,2025-02-10 01:50:19,Megan Hunter,4
2406,82,Terrible movie! Relationship middle partner you.,2025-02-22 12:27:37,Andrea Maxwell,1
2407,82,Could have been better. Success role generation fight.,2025-03-05 06:15:54,Heidi Taylor,2
2408,82,"Some good moments, but overall meh. Floor investment exist know.",2025-02-27 05:40:55,Dr. Christopher Meadows,3
2409,82,Worst movie I've seen this year. Animal name eight lose.,2025-02-27 00:30:40,Danny Trevino,1
2410,82,Waste of time and money. Light here appear mean issue.,2025-02-23 15:13:27,Beth Lopez,1
2411,82,Worst movie I've seen this year. Spring tell plant toward travel myself.,2025-02-10 19:53:47,Jacob Chapman,1
2412,82,Great movie with some minor flaws. Western sit exist at yes by show.,2025-02-21 06:05:48,Albert Thompson,4
2413,82,Waste of time and money. Early buy middle want.,2025-03-02 04:12:36,Melanie Patel,1
2414,82,Great movie with some minor flaws. Bill safe safe notice important pass.,2025-02-08 17:02:10,Troy Patton,4
2415,82,Would recommend to friends. Ten attorney hope season board computer break.,2025-02-11 15:51:03,Anna Zamora,4
2416,82,Best movie I've seen in years! Whole source girl image above appear.,2025-02-24 22:42:42,Susan Hernandez,5
2417,82,Best movie I've seen in years! Must her word it building recently.,2025-02-10 10:11:26,Steve Graham,5
2418,82,Could have been better. Human site occur best size experience low.,2025-02-17 03:39:07,Thomas Erickson,2
2419,82,"Some good moments, but overall meh. Wide produce order establish star right.",2025-02-18 05:59:39,Bruce Floyd,3
2420,83,Terrible movie! Heart save whether rich.,2025-02-10 15:09:39,Elizabeth Snyder,1
2421,83,Best movie I've seen in years! Win thought expect chair.,2025-02-11 16:00:29,Richard Jacobs,5
2422,83,Great movie with some minor flaws. List husband low.,2025-02-11 10:07:09,William Foster,4
2423,83,"Decent, but forgettable. Figure style increase ago about who.",2025-02-08 20:59:01,Marcus Sanders,3
2424,83,"Decent, but forgettable. Prevent could growth style instead.",2025-02-19 04:38:47,Victoria Livingston,3
2425,83,Average movie. Church perform change almost such.,2025-02-20 17:42:10,Monica Warner,3
2426,83,Really enjoyed it! Natural meeting everything large leader.,2025-02-16 11:12:46,Jonathan Sanchez,4
2427,83,"Some good moments, but overall meh. Network world relationship science manager stock maybe.",2025-02-27 01:16:45,Karen Jackson,3
2428,83,Absolutely amazing! Tree technology act.,2025-02-08 00:18:30,Charlene Hudson,5
2429,83,Best movie I've seen in years! Citizen these political size bar before world shoulder.,2025-02-09 06:09:04,Alexandra Barker,5
2430,83,Waste of time and money. Available after space matter financial like certain.,2025-02-17 12:28:12,Patrick Moss,1
2431,83,Not worth the ticket price. School pick start teacher page task smile.,2025-02-19 00:30:35,Amber Wheeler,2
2432,83,Worst movie I've seen this year. Daughter old side nature design watch.,2025-02-10 16:59:01,Ryan Thomas DVM,1
2433,83,Waste of time and money. Film subject number ready.,2025-02-06 14:21:52,Timothy Davis,1
2434,83,Could have been better. Foreign back claim often maybe bit what.,2025-02-05 18:53:30,Jacob Dunlap,2
2435,83,Worst movie I've seen this year. Billion research fear trial offer follow.,2025-03-03 17:16:14,Amy Park,1
2436,83,Really enjoyed it! Note say area effort everybody.,2025-03-04 05:04:11,Clayton Glover,4
