review_id,movie_id,content,review_date,reviewer_name,rating
1,1,Disappointing. World artist heavy write year.,2025-03-02 23:06:27,Randy Moon,2
2,1,"Decent, but forgettable. Voice degree why wonder kitchen.",2025-02-21 02:54:29,Maurice Adkins,3
3,1,Disappointing. Heavy fact of may.,2025-02-21 15:03:32,Linda Stephens,2
4,1,Really enjoyed it! Technology author why how.,2025-02-15 10:02:18,Dr. Jeffrey Martinez,4
5,1,"Decent, but forgettable. Realize age box single matter author design.",2025-02-08 21:20:20,Julie Oneill,3
6,1,Worst movie I've seen this year. Section item occur yourself.,2025-02-19 22:53:09,Donna Smith,1
7,1,Disappointing. Sea quickly think exist lead.,2025-02-08 15:10:09,Kelly Stewart,2
8,1,Masterpiece! Agency enjoy really through Mr.,2025-02-12 01:13:19,Kim Wagner,5
9,1,Really enjoyed it! Contain will finally or budget.,2025-02-15 20:22:17,Susan Lee,4
10,1,Worst movie I've seen this year. Ready watch stay state more make else.,2025-02-28 00:40:15,Peter Phillips,1
11,1,Disappointing. Respond relationship road difference like test.,2025-02-10 09:15:45,John Jones,2
12,1,Average movie. Six within behind care.,2025-02-19 21:55:14,Dawn Stuart,3
13,1,Average movie. Test place point loss factor effect.,2025-02-24 19:53:39,Taylor Riddle,3
14,1,"Decent, but forgettable. Eight ok into.",2025-02-07 21:41:11,Joseph Porter,3
15,1,Could have been better. Beautiful deal major interest.,2025-03-03 13:29:00,Sara Becker,2
16,1,Really enjoyed it! Often least wall lot.,2025-02-13 20:17:39,Lisa Smith,4
17,1,Waste of time and money. Might yes ever pressure.,2025-02-25 05:55:48,Heather Gray,1
18,1,Best movie I've seen in years! Make matter expect someone such feel toward.,2025-02-15 01:05:11,Rachael Walter DDS,5
19,1,"Decent, but forgettable. Media nature our who not.",2025-02-20 15:40:42,John Cantrell,3
20,1,Disappointing. Some similar contain opportunity.,2025-02-24 19:44:44,Curtis Morales,2
21,1,Terrible movie! Same suddenly low chair station.,2025-02-28 17:18:26,Phyllis Martin,1
22,1,Masterpiece! Stock another whom debate.,2025-02-10 19:19:02,Angela Garcia,5
23,1,Would recommend to friends. Structure various price.,2025-02-19 16:11:00,Kristin Harrington,4
24,1,Could have been better. Manager fall ability many behind happen.,2025-02-24 14:51:55,Kelli Wells,2
25,1,Great movie with some minor flaws. Probably stuff anyone somebody success deep.,2025-02-23 09:24:46,Kerri Spencer,4
26,1,Average movie. Local even do need build level.,2025-02-20 17:02:53,Molly Frost,3
27,1,"Decent, but forgettable. Maybe science during behavior.",2025-02-06 07:59:47,Daniel Lee,3
28,1,Waste of time and money. Subject visit can man high risk capital.,2025-02-22 01:23:23,Jackie Collier,1
29,1,Disappointing. Week doctor from yard oil.,2025-03-02 20:25:22,Gloria Cooper,2
30,1,"Decent, but forgettable. Newspaper much of sell keep number.",2025-02-08 00:21:22,Margaret Blanchard,3
31,1,Absolutely amazing! Similar discuss indicate friend church others star.,2025-02-19 20:19:43,Katherine Reese,5
32,1,Disappointing. Look position support candidate job.,2025-02-18 21:22:00,Peter Campbell,2
33,1,Disappointing. Politics budget part letter level activity.,2025-02-05 13:13:51,Christine Newman,2
34,1,"Decent, but forgettable. History throw future fear might.",2025-02-14 15:45:22,Kimberly Reyes,3
35,1,Not worth the ticket price. Himself yeah hard politics protect modern hit.,2025-02-17 05:03:57,Laura Allen MD,2
36,2,Great movie with some minor flaws. Authority bit according fast attention conference relationship phone.,2025-02-10 13:30:41,Becky Leblanc,4
37,2,Could have been better. Often and lay fire ok.,2025-02-19 19:00:37,Lynn Jones,2
38,2,"Decent, but forgettable. Whether player from center light senior front experience.",2025-02-23 11:27:14,Ryan Alexander,3
39,2,"Decent, but forgettable. Foot current push beautiful.",2025-02-16 11:00:06,Judy Vargas,3
40,2,Would recommend to friends. Despite must reveal nature cost prevent reflect way.,2025-03-06 15:27:00,Mario Dawson,4
41,2,"Decent, but forgettable. Adult should prevent member material.",2025-03-04 14:24:48,David Collier,3
42,2,Could have been better. Catch blue drive standard than third food.,2025-02-09 01:37:38,Cynthia Taylor,2
43,2,"Decent, but forgettable. Question analysis woman they.",2025-02-13 20:34:57,Jeffrey Hughes DDS,3
44,2,Waste of time and money. Young score job similar task director.,2025-02-17 18:30:50,Clinton House,1
45,2,Masterpiece! Style push father spring audience bar account.,2025-02-07 09:13:16,Andrew Bell,5
46,2,Great movie with some minor flaws. Tv contain yes certain board see model whole.,2025-02-21 05:54:29,Brittany Mcdonald,4
47,2,"Some good moments, but overall meh. Start physical among where space impact reach.",2025-02-23 15:33:02,Joseph Hawkins,3
48,2,Could have been better. Early own receive arm him.,2025-02-27 05:34:31,Jonathan Hall,2
49,2,Great movie with some minor flaws. South decision already call mouth section.,2025-02-05 01:12:00,Elizabeth Johnson,4
50,2,Absolutely amazing! Claim general power each south citizen data.,2025-02-22 23:10:36,Tamara Gomez,5
51,2,Would recommend to friends. Class street window stock garden everybody smile report.,2025-02-17 20:19:24,Daniel Bridges,4
52,2,"Decent, but forgettable. Act particular set most situation central authority.",2025-02-11 01:20:17,Katelyn Stevenson,3
53,2,"Some good moments, but overall meh. Someone tax so authority decide determine realize.",2025-03-04 12:24:46,Melissa Nolan,3
54,2,Best movie I've seen in years! Act member response before.,2025-03-03 09:56:07,Rebecca Holmes,5
55,2,Great movie with some minor flaws. Soon say hospital do thus.,2025-02-06 11:28:16,Martha Walker,4
56,2,Not worth the ticket price. Candidate level dog partner.,2025-02-20 20:51:56,Nathan Perez,2
57,2,Best movie I've seen in years! Building toward forward leader response.,2025-02-24 20:35:16,Kayla Johnson,5
58,2,Absolutely amazing! Her wall ok forget event note property.,2025-03-02 01:54:39,Michael Stevens,5
59,2,Would recommend to friends. Seat television assume simply myself talk sport strong.,2025-02-20 08:35:31,Stacy Miller,4
60,2,Not worth the ticket price. Attorney meet concern.,2025-02-08 14:10:06,Amy Perry,2
61,2,Not worth the ticket price. Mission book before free surface mother traditional.,2025-02-16 17:52:40,Katrina Cook,2
62,2,Disappointing. Management eight be turn over Mrs unit.,2025-02-25 07:09:22,Robert Lyons,2
63,3,Not worth the ticket price. Employee drop book work.,2025-02-15 12:11:10,Neil Williams,2
64,3,Worst movie I've seen this year. Own table win enough debate either red.,2025-02-10 12:14:55,Matthew Johnson,1
65,3,Could have been better. Similar thought forget page.,2025-02-13 11:14:50,Theresa Prince,2
66,3,Disappointing. Base bad above else remember relationship story usually.,2025-03-06 07:02:17,Jennifer Hernandez,2
67,3,"Decent, but forgettable. Fast do ever inside wife will.",2025-02-09 12:00:04,Lauren Cantrell,3
68,3,Great movie with some minor flaws. Medical financial wrong herself garden.,2025-02-12 07:59:00,Terry Harper,4
69,3,Not worth the ticket price. Attention success American candidate sing.,2025-02-15 02:02:06,Heather Watson,2
70,3,Worst movie I've seen this year. Bag project size power.,2025-03-02 17:08:30,Lauren Cole,1
71,3,Masterpiece! Deal scientist decide bit.,2025-02-21 12:31:12,Heather Dean,5
72,3,Great movie with some minor flaws. Fly low head be.,2025-03-04 15:27:03,Mr. Michael Smith,4
73,3,Great movie with some minor flaws. None management simply statement allow can.,2025-02-25 19:13:24,Lauren Hernandez,4
74,3,Terrible movie! Across home bed late last safe finally.,2025-02-20 15:18:35,Mrs. Lauren Smith,1
75,3,Great movie with some minor flaws. Scientist sort common left doctor bank.,2025-02-13 01:43:04,Douglas Torres,4
76,3,Best movie I've seen in years! Thus drop everybody measure.,2025-03-05 20:18:15,Ricardo Kane,5
77,3,Really enjoyed it! Check establish main PM use design daughter.,2025-02-06 16:56:15,Samuel Gonzalez,4
78,3,Masterpiece! Including fish use outside myself.,2025-02-07 15:09:15,Marcia Salas,5
79,3,Average movie. Data occur media much last talk.,2025-02-19 13:49:31,Victoria Underwood,3
80,3,Waste of time and money. Mean onto standard.,2025-03-04 05:02:27,Claire Salazar,1
81,3,Worst movie I've seen this year. Production mean once energy involve view power.,2025-02-19 21:21:54,Robert Huber,1
82,3,Waste of time and money. Amount color worker issue.,2025-03-06 00:59:42,Brandon Contreras,1
83,3,Would recommend to friends. Accept wish beautiful production garden doctor every.,2025-03-02 15:20:06,Gary Goodman,4
84,3,Disappointing. Receive foot walk environmental fear structure.,2025-02-14 09:56:45,David Harris,2
85,3,Great movie with some minor flaws. Also report worry personal a.,2025-02-21 03:42:40,Cynthia Henry,4
86,3,"Some good moments, but overall meh. First central traditional likely win rate grow between.",2025-02-10 16:28:22,Jasmine Rangel,3
87,3,Not worth the ticket price. Upon near happy radio whom.,2025-02-10 05:23:43,Monique Morrow,2
88,3,Disappointing. Too specific trip feeling tough south.,2025-02-09 02:18:33,Miss Erica Armstrong,2
89,3,Absolutely amazing! Response matter research.,2025-02-14 10:12:07,Sarah Yang,5
90,4,Average movie. White forward oil concern dream far.,2025-03-01 16:07:11,Debra Shepherd,3
91,4,Would recommend to friends. Page home manager decade difference.,2025-02-17 21:33:44,David Turner,4
92,4,Great movie with some minor flaws. Cup necessary will half bank.,2025-03-05 09:36:13,Amy Meyers,4
93,4,Masterpiece! Personal kitchen eight must statement control.,2025-02-18 05:40:51,James Castillo,5
94,4,Would recommend to friends. Your down since data group season.,2025-02-08 17:51:34,Faith Turner,4
95,4,Best movie I've seen in years! Morning alone institution experience scientist free.,2025-03-05 02:54:48,Caleb Rios,5
96,4,Disappointing. Practice throw red political into produce these military.,2025-02-26 09:12:35,Kathleen Ford,2
97,4,"Some good moments, but overall meh. Scientist authority over author watch stand leg.",2025-03-01 10:05:28,Brian Jimenez,3
98,4,Absolutely amazing! Difference among look team structure new.,2025-02-19 19:14:43,Christopher Smith,5
99,4,Could have been better. Summer avoid social old.,2025-03-01 02:07:17,John Chandler,2
100,4,"Decent, but forgettable. Often bring attorney speech.",2025-02-28 22:07:15,Dana Gonzalez,3
101,4,Really enjoyed it! Reveal north character rise.,2025-02-11 09:01:37,Michael Taylor,4
102,4,"Some good moments, but overall meh. Civil dream shoulder attack deal area.",2025-03-01 15:44:48,Jermaine Odonnell,3
103,4,Really enjoyed it! Girl could analysis throw technology.,2025-02-28 07:37:54,Jose Sanders,4
104,4,Really enjoyed it! Adult let amount important.,2025-02-13 10:06:30,Holly Schultz,4
105,4,Masterpiece! Me claim into.,2025-02-24 02:49:41,Susan Mckenzie,5
106,4,Not worth the ticket price. Good big two example direction room statement.,2025-02-21 03:01:00,Kelly Alexander,2
107,4,Disappointing. Skill who drop space father open over lawyer.,2025-03-04 04:41:46,Audrey Anderson,2
108,4,Great movie with some minor flaws. Democratic next key usually.,2025-02-11 21:32:52,Thomas Joyce,4
109,4,Could have been better. Skill partner even necessary speech expect.,2025-02-21 17:07:20,Laura Espinoza,2
110,4,Absolutely amazing! Deep thank can more camera.,2025-02-13 10:17:42,Sheila Barker,5
111,4,Best movie I've seen in years! Body small seem simply some design sell.,2025-02-19 16:04:54,Bryan Simmons,5
112,4,Terrible movie! Deal soon style between.,2025-02-12 22:41:03,David Brown,1
113,4,Disappointing. Growth another not far.,2025-02-12 18:41:29,Michael Estes,2
114,4,Really enjoyed it! Wish suffer son candidate hand health learn.,2025-02-23 03:06:44,Mary Clay,4
115,4,Not worth the ticket price. Defense under economy officer show.,2025-02-26 07:22:51,Eric Taylor,2
116,4,Great movie with some minor flaws. Tend product behavior.,2025-02-05 18:36:22,James Mckee,4
117,4,"Decent, but forgettable. Service fast lead choose.",2025-02-14 00:56:04,Samuel White,3
118,5,Disappointing. Or near usually.,2025-02-16 14:45:10,Rachel Robinson,2
119,5,Would recommend to friends. Few act station.,2025-02-22 01:31:55,Steven Trujillo,4
120,5,Great movie with some minor flaws. Try wonder television positive discuss yes.,2025-03-05 13:32:11,Mary Rivera,4
121,5,Terrible movie! Wife crime wear that exist region.,2025-02-05 12:20:11,Michelle Ruiz,1
122,5,Great movie with some minor flaws. Change over boy car federal article.,2025-02-19 04:45:22,Melissa Mcdonald,4
123,5,Disappointing. Number animal per work dream nothing decide.,2025-02-23 16:49:38,Richard Schultz,2
124,5,Average movie. Happen information per large within both quite.,2025-02-10 11:25:18,Karen Olson,3
125,5,Best movie I've seen in years! Tend state doctor office life behind decade.,2025-02-07 09:57:54,Katherine Morgan,5
126,5,Great movie with some minor flaws. Begin least off common think sound.,2025-02-08 13:30:42,Deanna Logan,4
127,5,Really enjoyed it! Part TV police to major.,2025-02-27 19:58:11,Kevin Erickson,4
128,5,Disappointing. Better anyone gas because you.,2025-02-19 17:04:29,Amber Walter,2
129,5,Really enjoyed it! Add cause entire rise approach across along recently.,2025-02-27 19:20:01,Adam Smith,4
130,5,Average movie. Various view remain data.,2025-02-15 04:25:18,Robin Morales,3
131,5,Masterpiece! Late plan structure everything.,2025-02-07 03:54:27,Cynthia Owens,5
132,5,Could have been better. Hand guy mind place community when.,2025-02-22 19:15:03,Olivia Robinson MD,2
133,5,Waste of time and money. Always family option gun result guess series.,2025-02-07 11:34:42,Chad Cochran,1
134,5,Not worth the ticket price. Inside decide yard right.,2025-02-19 09:41:45,Edward Vaughan,2
135,5,Really enjoyed it! Think industry key history.,2025-03-01 11:08:09,Margaret Powell,4
136,5,Best movie I've seen in years! Marriage simple accept fear run away science surface.,2025-03-02 20:57:31,Tyler Cox,5
137,5,Average movie. Adult soon where bed.,2025-02-16 15:41:00,Robert Willis,3
138,5,Masterpiece! Girl really information now.,2025-02-10 14:18:03,Jamie Ross,5
139,5,Not worth the ticket price. Somebody certain third room.,2025-02-09 10:41:31,Craig Rios,2
140,5,Would recommend to friends. Customer himself still authority although glass participant.,2025-02-14 16:14:33,Ann Goodwin,4
141,5,Would recommend to friends. North maintain crime hit.,2025-02-21 01:19:12,Dr. Brent Williamson Jr.,4
142,5,Waste of time and money. Dinner thousand boy.,2025-02-09 12:54:10,Chris Taylor,1
143,6,Would recommend to friends. Money notice state develop pattern challenge serious.,2025-02-14 13:44:16,Christopher Giles,4
144,6,Could have been better. Offer magazine around common.,2025-02-28 19:41:25,Amanda Williams,2
145,6,"Decent, but forgettable. Your action now yes camera report.",2025-02-06 06:00:57,Elijah Snow,3
146,6,Worst movie I've seen this year. History raise professional church contain million shoulder right.,2025-02-13 09:16:30,Robert Mccoy,1
147,6,Terrible movie! Piece quality through next.,2025-03-05 02:06:48,Brandy Price,1
148,6,"Some good moments, but overall meh. Recent future factor difference key test.",2025-02-17 18:43:12,Anne Griffin,3
149,6,Disappointing. Democratic foot book upon current.,2025-02-07 17:27:20,Tina Leblanc,2
150,6,Could have been better. Most life east political.,2025-02-11 11:57:49,Willie Jones,2
151,6,Waste of time and money. Story available sort event whose.,2025-02-08 19:06:29,Dustin Rodgers,1
152,6,Would recommend to friends. Process appear cell maybe five.,2025-03-03 14:17:55,Douglas Cook,4
153,6,Could have been better. Let future success increase discuss nation.,2025-02-16 01:14:56,Tina Simon,2
154,6,Worst movie I've seen this year. Color coach risk without think.,2025-02-16 08:45:45,Shawn Austin,1
155,6,Really enjoyed it! Itself plan miss significant hear idea must.,2025-02-06 00:55:24,Zachary Harrell,4
156,6,Could have been better. Theory address idea point consider place face.,2025-02-22 12:47:46,Andrea Nash,2
157,6,Really enjoyed it! Need reason our force those.,2025-03-02 19:54:12,Alexandra Ramsey,4
158,6,Absolutely amazing! Difference position its simple.,2025-02-25 23:00:06,Keith Rhodes,5
159,6,Masterpiece! Ready attorney part rule evening person institution summer.,2025-02-06 17:34:07,Brenda Stanley,5
160,6,"Decent, but forgettable. Understand fact campaign begin federal citizen.",2025-02-19 00:08:48,Jeremy Brown,3
161,6,Great movie with some minor flaws. Life method member.,2025-02-11 13:59:54,Jesse Ward,4
162,6,Not worth the ticket price. Wide medical develop wonder different detail walk.,2025-02-15 07:32:18,Joseph Flowers,2
163,6,Masterpiece! Four so indicate green.,2025-02-10 23:20:53,Christopher White,5
164,6,Average movie. Day traditional woman discover major ten.,2025-02-18 11:46:09,Melinda Smith,3
165,6,Absolutely amazing! Cut first loss wear white anyone.,2025-03-01 17:52:46,Stephanie Stone,5
166,6,Disappointing. Scientist conference strong street huge still consumer.,2025-03-02 17:33:42,Miss Erin Arroyo,2
167,6,Could have been better. Service similar option.,2025-02-10 11:55:24,Michael Maxwell,2
168,6,Worst movie I've seen this year. Protect lose huge firm.,2025-02-06 15:07:38,Katherine Curry,1
169,6,"Some good moments, but overall meh. Where daughter season mission study second.",2025-02-15 09:10:31,Richard Schneider,3
170,6,Would recommend to friends. Anyone her create quite one government than.,2025-03-06 13:45:11,Cody Manning,4
171,6,Worst movie I've seen this year. Page seat fear remain TV stand.,2025-02-28 13:14:22,Andrew Ruiz,1
172,6,Would recommend to friends. Loss room task this box face.,2025-02-10 01:22:22,Tonya Simpson,4
173,6,Terrible movie! Respond how your book.,2025-02-19 17:53:48,Cynthia Miller,1
174,6,Would recommend to friends. Accept just summer when institution.,2025-02-09 01:52:53,Michael Forbes,4
175,6,Not worth the ticket price. Participant process be art according.,2025-03-02 15:49:39,Christopher Lozano,2
176,6,Terrible movie! Edge its necessary how adult weight house weight.,2025-03-02 07:08:06,Jennifer Andrade,1
177,7,Not worth the ticket price. Business once stuff.,2025-02-14 05:53:32,Amy Briggs,2
178,7,"Decent, but forgettable. Provide plant site authority easy.",2025-03-05 00:38:52,Hunter Rodriguez,3
179,7,Masterpiece! Camera generation minute firm when.,2025-02-11 19:24:13,Crystal Smith,5
180,7,Great movie with some minor flaws. Rule under high parent.,2025-02-24 01:59:11,Larry Woodard,4
181,7,Masterpiece! Member benefit pretty goal.,2025-02-19 04:08:23,Cindy Franklin,5
182,7,Great movie with some minor flaws. Western born south someone now.,2025-02-21 20:03:58,Kevin Thompson,4
183,7,"Some good moments, but overall meh. Oil stage any although my he argue.",2025-02-13 10:43:41,Amber Long,3
184,7,Worst movie I've seen this year. Minute door five.,2025-02-16 06:07:09,Stephanie Sharp,1
185,7,Terrible movie! Similar toward reveal reach material.,2025-02-25 04:39:55,Margaret Vasquez,1
186,7,Really enjoyed it! Second time discussion art possible.,2025-02-22 11:07:31,Zachary Moore,4
187,7,Great movie with some minor flaws. Edge maintain maintain born test new.,2025-02-23 08:52:01,Mr. Ryan Hull,4
188,7,Absolutely amazing! Up we give color lot beyond nature.,2025-02-21 19:10:47,Rickey Cummings,5
189,7,Could have been better. Director environment growth style grow life news.,2025-02-06 09:22:04,Joyce Orozco,2
190,7,Not worth the ticket price. Radio there political live.,2025-02-12 17:55:32,Courtney Mueller,2
191,7,Would recommend to friends. Behavior cup speech interest piece.,2025-03-04 01:11:35,Steven Smith,4
192,7,Terrible movie! Way few growth our.,2025-03-03 08:41:32,Matthew Johnson,1
193,7,Masterpiece! Final he near continue letter include evidence.,2025-02-25 00:35:17,Ashley Hudson,5
194,7,Terrible movie! Similar hold party speak rather executive her.,2025-03-05 07:13:52,Carl Hudson,1
195,7,Average movie. Writer since blood word road anything.,2025-02-08 23:26:33,Ashley Jenkins,3
196,7,Terrible movie! Leave strong reason second.,2025-02-17 02:55:46,Autumn Fletcher,1
197,7,Really enjoyed it! Body issue whole.,2025-02-28 04:58:16,Jennifer Barnes,4
198,7,"Decent, but forgettable. Environmental national project along however friend.",2025-02-24 06:51:37,Nancy Shaffer,3
199,7,Best movie I've seen in years! Very best answer century.,2025-02-05 05:12:25,Zachary Gonzalez,5
200,7,Could have been better. Successful expect similar statement along build world.,2025-02-13 23:50:53,Julia Davis,2
201,7,"Some good moments, but overall meh. Local eye design tree late can.",2025-02-25 21:02:49,David Payne,3
202,7,Would recommend to friends. Stuff reveal me reach guess old.,2025-03-01 05:11:17,Brandon Rasmussen,4
203,7,Best movie I've seen in years! Drug involve they we window hard page.,2025-02-22 06:36:12,Mr. Michael Hayes,5
204,7,Average movie. Institution girl generation growth.,2025-03-04 13:25:05,Thomas Woods,3
205,7,Absolutely amazing! Science main central.,2025-02-25 07:49:58,Aaron Miller,5
206,8,Disappointing. Meet government population drive.,2025-03-04 19:03:50,Kent Henderson,2
207,8,Not worth the ticket price. Trip child concern executive.,2025-03-05 08:45:38,Jessica Smith,2
208,8,Would recommend to friends. Evening area argue him indicate unit country.,2025-02-21 19:54:18,Brent Garcia,4
209,8,Terrible movie! Six watch city represent sea kid Congress.,2025-02-20 03:52:22,Emily Williams,1
210,8,Would recommend to friends. Project man really treat.,2025-02-06 01:18:00,Rebekah Zamora,4
211,8,Would recommend to friends. Democrat so cover unit leg foot.,2025-03-03 04:27:34,Martin Walker,4
212,8,Disappointing. Region drive tonight first.,2025-02-17 04:41:48,Sean Murphy,2
213,8,Best movie I've seen in years! Through theory your tax within.,2025-03-03 08:57:34,Ryan Carpenter,5
214,8,"Some good moments, but overall meh. Produce cause maybe here.",2025-02-09 15:08:40,Amanda Payne,3
215,8,Great movie with some minor flaws. Life ability down fish network pick.,2025-02-23 00:55:33,Samantha Rodriguez,4
216,8,Best movie I've seen in years! Change relate behavior up ask ask.,2025-02-14 17:48:47,Gregory Hamilton,5
217,8,"Some good moments, but overall meh. Offer from third standard society course.",2025-02-13 17:01:32,Adam Thompson,3
218,8,Could have been better. Kid challenge trip room before.,2025-03-01 02:18:31,Krystal Clark,2
219,8,Absolutely amazing! Interview ready off media simple nature decide.,2025-02-10 17:34:51,Christopher Livingston,5
220,8,Best movie I've seen in years! Pressure its protect feeling idea protect raise.,2025-02-07 23:59:50,Steven Pittman,5
221,8,Not worth the ticket price. Break economic head light.,2025-02-21 01:28:02,Steven Wallace,2
222,8,Waste of time and money. Force few within see.,2025-02-19 19:58:10,Thomas Martinez,1
223,8,Waste of time and money. Charge both crime special stock.,2025-02-26 23:30:49,James Murphy,1
224,8,Worst movie I've seen this year. Court term recent in.,2025-02-26 08:34:41,Jacob Martinez,1
225,8,Average movie. Physical type price machine own piece question girl.,2025-03-03 10:46:23,Candice Alvarez,3
226,8,Average movie. Strategy matter avoid third true.,2025-02-07 22:00:51,Daniel Klein,3
227,8,Disappointing. By window decision better nature history.,2025-03-04 06:13:16,Christina Ross,2
228,8,Could have been better. Large result method party reach population.,2025-02-22 16:31:38,Christian Macdonald,2
229,8,Really enjoyed it! Across kitchen piece rise.,2025-02-14 23:03:28,Alexis Perez,4
230,8,Disappointing. Task someone save hear against art skill.,2025-02-16 07:32:37,Caleb Mendoza,2
231,8,Not worth the ticket price. Budget simple everything property rock.,2025-02-17 10:19:46,Jacqueline Marshall,2
232,8,Not worth the ticket price. Southern many fire soldier usually.,2025-03-04 06:53:03,Jaime Stevens,2
233,8,Not worth the ticket price. One standard food as purpose four.,2025-02-15 23:57:02,Pam Garcia,2
234,8,Could have been better. Analysis until claim former person fire.,2025-02-05 22:33:29,Danielle Abbott,2
235,8,"Decent, but forgettable. What education she.",2025-02-11 02:07:27,Elijah Abbott,3
236,8,Disappointing. Much team today budget in movie fly site.,2025-02-17 22:10:11,Daniel Maxwell,2
237,8,Could have been better. Talk sister own product but.,2025-02-16 21:38:56,Kathryn Farrell,2
238,8,Not worth the ticket price. On art room government everything.,2025-02-07 14:35:08,Richard Farmer,2
239,8,Great movie with some minor flaws. Side religious light thing check.,2025-03-02 16:27:38,Keith Gaines,4
240,8,"Decent, but forgettable. Should class well receive.",2025-02-23 16:00:42,Adam Clark,3
241,9,Absolutely amazing! Run of sure fine.,2025-02-10 19:32:48,Julia Durham,5
242,9,"Decent, but forgettable. Street determine career short dream.",2025-02-12 15:26:23,Holly Oneal,3
243,9,Absolutely amazing! Suffer collection whole marriage.,2025-02-24 14:55:02,Angel Brewer,5
244,9,Best movie I've seen in years! Relate enter to several course huge quality.,2025-02-12 01:20:25,Ashley Foster,5
245,9,Not worth the ticket price. Someone member wait authority.,2025-03-02 04:36:36,Kristin Wilson,2
246,9,"Decent, but forgettable. Like happen establish rock begin.",2025-02-28 03:39:21,Dylan Gardner,3
247,9,Could have been better. Recently most sister than direction speak happy.,2025-03-02 13:16:37,Andres Thomas,2
248,9,Would recommend to friends. Field west require news arrive catch face way.,2025-02-10 23:22:09,Sandra Christensen,4
249,9,Terrible movie! Month keep population who follow wide theory book.,2025-02-25 22:07:49,Timothy Jones,1
